,Category,text
1715,0,esta sociedad sigue enseñando a las mujeres a cuidarse para no ser violadas en vez de enseñar a los hombres a no violar 
1716,0, un chocolatito juchiteco ah q puto frio 
1717,0, jajaja no nada más no me pongas imágenes feas 
1718,0,hipocritas les llaman lo bueno es que soy bien mamona y los mando a la chingada 
1719,0,y te apuesto a que el joto es a quien más duro le va a tirar a la comunidad 
1720,0, jajajajajaja lo siento princesita ta' cabrón éste pedo 
1721,0, así te informas y sales del pensamiento único que rigor madre mía que rigor 
1722,0,todos tenemos ese alter ego que todo mundo odia y le quieren partir la madre la verdad 
1723,0,así mi cara cuando veo mi agenda llena de putas juntas 
1724,1,yo aquí pudiendo quererte bonito y tú haya quejándote de que nadie te quiere hijo de tu madre 
1725,0, jajajaja ya no soy madre luchona ya me rescate amiguitaaa 
1726,0, realmente estás obsesionado con esa madre del huracán 
1727,0,solo quiero decirle al sujeto que me gritó cosas feas mientras iba a la universidad que me hizo llorar del pinche susto y me traumó alv 
1728,0, el camote está bueno con una textura linda betty ligando 
1729,1,mujeres que saben chiflar dónde se esconden la verga 
1730,0,me compré un vestido y zabdiel ya se fue verga 
1731,0,amigos este tweet me ha hecho reflexionar ya no diré verga diré v word porque me veo muy vulgar gracias 
1732,1,putos cangrejos de mierda ya quisieran los argentinos tener un chicharito que las meta hasta con la nuca no se valora 
1733,1,ese gonzalo es todo un maricon como todos los chivahermanos 
1734,0,como toda mamá luchona no más sube al balcón con vestidazo 
1735,0, jajaja mi tatuaje de gustavo cerati en la nalga derecha no está de acuerdo con tus mentiras de señora ardida 
1736,1,véanlo bien ese pinche joto quiere destruir a los eeuu pero si sus misiles nucleares caen fuera del objetivo pueden impactar a méxico 
1737,0,para que madre hacen un grupo de whatsapp los de la escuela si no les van a responder a todos 
1738,0, que puto centro pusiste para el gol bien guti rifado 
1739,1,me lleva la verga ya empataron los putos narizones de cagada 
1740,0,valer verga en la vida es consecuencia de muchos ya que pedo acumulados 
1741,0,no sé por qué les caigo gorda si soy súper buen pedo la mera verga y así 
1742,1,sigan de pecadores putos que creen que por el temblor no les voy a enseñar la verga hoy o que 
1743,0,prefiero mil veces que me den en toda la madre diciéndome la verdad a que me endulcen el oído con pinches mentiras 
1744,0,traigo un conflicto bien cañon con las narices feas 
1745,0,luchaaaa lucha por tus metas se una chef luchona soy tu fan 
1746,1,si conocieran a mi vecina le darían el premio a la mujer mas loca y penamp de la vida 
1747,0,y que tal la de molotov mama te esta volviendo loca jejeje 
1748,1, q se puede esperar del maricon de closet de la yañez aun recuerdo esa ves q lo vi en zona rosa viendo quien lo levantada 
1749,0,me voy a vengar de todos mis amigos que me etiquetan en videos de putos sapos 
1750,0,thnks god tengo la que no me da hambreporque puedo valer verga pero no ser gorda 
1751,0,ahorita dices de rancho joto pero qué tal cuando las cantas 
1752,0,una flaquita tetona recibe su dotación mientras chupa otra verga ¡mira su cara de placer rt para más vídeos 
1753,0,el temple de la verdadera fiminista una madre que es capaz de dar a luz y caminar con su hijo en brazos 
1754,1,wow no puedo ser el único arto de los juegitos de y joder parecen putos payasos de circo 
1755,0,pero quería andar de loca ahora ya no sé que hacer ‍ 
1756,0,intente cocinar un camote en el microondas y casi incendio la casa don´t do it 
1757,0,sienten que su día va pa la madre a una compañera se le fue una nude al chat de trabajo mañana le llevo un rastrillo 
1758,1,y se la tragaron completa los hdp y les valió madre 
1759,0,por qué será que tienes todo lo que a mí me gusta sobre todo esa verga que te cargas 
1760,0,que hermosa a esta verga sí le entrego mi virginidad jaja 
1761,0,aunque me cagues brilla pero algún día construiré mi súper misil para mandarte a la merga 
1762,1,y chingas a tu puta madre si te llego a encontrar maricón de mierda no vas a valer ni centavos y me vale verga si tienes familia puto 
1763,0,quién traicionó al pueblo de méxico y a su partido para aliarse con las víboras prietas que prometió combatir se lanza contra alfonso romo 
1764,0, x extraño los videoblogs de por lo menos minutos aunque siguen estando con madre 
1765,0,eh deja el grupo en paz los putos somos nosotros 
1766,0, si fuera china de billete tendría las cartas que quiero qoq pero pues una es mujer luchona con sus juegos instalados 
1767,0,me puse re gorda tengo que hacer dieta 
1768,1,si decir todas estas putas mamadas de primaria es que tu ganaste chinga tu madre abogadin 
1769,0,stream en minutos hay que aprovechar a la vieja mercy antes que llegue la mercy luchona v 
1770,0,si viejo desde el patrón del mal o el cartel de los sapos que también sale este personaje siempre interpretado como gay… 
1771,0,no es que me valga verga tu vida es que me vale verga la vida de todo el mundo 
1772,1,que buena cachetada eso te sacas por mierda y culo ah y por pinche marica jajaja 
1773,0,ya soy ese tipo de amiga que solo se escucha que grita putas putas para todos 
1774,0,los hombres no son putos no dan pena y no son menos hombres cuando tratan de una forma bonita decente y tierna a su pareja frente a todos 
1775,1,la novia de luis no cae por que sabe como es esa golfa 
1776,0, si me dieron ganitas de chillar pero 
1777,0,que tanto pedo por no querer escribir verga vi wird verga se dice y se escribe 
1778,0, ''es mejor valer verga que no valer nada'' yo dándome ánimos 'v 
1779,0,no sé quién pidió eso el fracasó del wii u no creo que sea por la falta de prácticas de dlc pero si está de la mierda 
1780,1,y coge la puta gorda de los cojones y me dice si es que del madrid tenías que ser llevaba la sudadera del madrid 
1781,0,odio las pibas que son tan putas y después cuando la tratan como tal se quejan 
1782,0,me quemé un dedo con el sartén por gorda desesperada 
1783,0, yo diría la falta de una pizca de decencia de sensibilidad ante los más desprotegidos en este país no tienes madre 
1784,0,servicio a caballeros gordita sexy y te atiendo en hotel o motel 
1785,1, como que tienes mucha fijación en el miembro masculino has de ser maricon de closet pues chiva eres lo más seguro es que si 
1786,1,andate a chile sampaoli mapuche y la reputa madre que te parió 
1787,1,no toquen a malditos hijos de su perra pinche madre 
1788,1,avisen cuando esta permitido putear a estos hijos de mil putas digo porque no se les puede decir nada que aca se enojan 
1789,1,anden putos recuerdan el fuera de esto se llama ehhhhhhhh 
1790,0,tengo más putas que un puntero mi hermano dos putas bien buenas y tú sigues con la mano 
1791,0,uy mijos las geométrias me salen igual de feas que yo ‍ 
1792,0,no puedo creer que mejor mi papá escucha reggaeton que yo eso es muy cagado 
1793,0,hay personas a las que quiero mucho pero a ellos les encanta valer verga yo que puedo hacer 
1794,0,wow que buen cuerpo y verga tiene y a ustedes como les gustan flacos o musculosos 
1795,1,ya pinche rómulo aga gonzález deja de mamar un rato 
1796,1,que puto asco de personas se dicen ser tus amigos 
1797,0,que le de like a tus fotos más feas 
1798,1,holanda no clasifico al mundial por fin les llego al karma a los putos 
1799,0,matías romero oaxaca de pie y con ganas de salir adelante ¡qué orgullo por esto te amo mi méxico por tu gente… <> 
1800,0,las conversaciones en el comedor del trabajo son puros putos problemas de mireyes que papi ya no me paga esto o aquello que asco 
1801,0,y se preguntan por qué tanto huracán se llama karma y la madre natureleza asi purga por tanto maltrato 
1802,0, para mi mi abuelita es mi absoluta madre 
1803,0,psicopatología los perversos son cínicos no hay verguenza culpa o asco no hay ideología ni principios en suma reniegan hasta d su madre 
1804,0,no creía que estaba tan loca solo recuerdo que me enoje mucho le rompí su celular 
1805,1, oye gata eres mexicana además de naquísima porqué puta madre escribes en inglés sirvientucha 
1806,0,ay no entre más veo crepúsculo más tonta se me hace y mas risa me da hahahahahha 
1807,0, gracias por su compra seguro lucen maravillosas en una mujer tan bella como tu nena 
1808,0,yo era muy gorda pero mi metabolismo se aceleró 
1809,0,aún me falta la tarea de análisis de las organizaciones y el examen de análisis político but at least no me hice pendeja todo el día 
1810,0,la noche es de los poetas las putas y los que mueren de amor 
1811,0,mañana a reforma y después a mamar vidrio jajaja jalas o te pandeas 
1812,0,déjame decirte que tu gato es puto se puede unir al club de gatos putos con mi gato 
1813,0,porque cuando me subo a mi puto burro no hay quien me baje 
1814,1,para que sigan mamando al pendejo de teófilo gutiérrez subnormales 
1815,0,no me estoy jugando ir a la cárcel estaría preocupado si hiciera un magazine gay 
1816,1,acosaron a la amiga de mi novio en el camión que vayan a acosar a sus putas madres hijos de la chingada 
1817,0,chingada madre llevo años aquí no mames 
1818,0,ya nitrovalió verga la cohesión grupal este semestre 
1819,0,una chica excelente bastante loca de a ratos a veces tan triste a veces tan muerta de risa a veces mala 
1820,0,entonces se supone que hay que aceptar insultos solo por modano mamar 
1821,0,un lugar para descansar en la sierra gorda 
1822,0,me acaban de decir que la mitad de mis tuits se pueden citar con el hashtag y sí pero pues que le valga verga 
1823,0,la chica de humo es la mejor canción del pop en español fav si estás de acuerdo putos no 
1824,0,si comparamos a puebla con el resto del país no está tan de la verga 
1825,0,extraño un chingo cuando íbamos a rompernos la madre en el futbolito cada salida 
1826,0,ojalá un día me valgas la misma verga que al vato de la cfe despelucando y ponchando a medio del puente del puente a cd judicial 
1827,0,la puta madre gooooool putas 
1828,0,me gusta la forma en que cabalga hasta se me paro la verga 
1829,0,esa mujer de intelectual no tiene ni madres sólo copia lo que escribe 
1830,0, te amo eres cabrona no lo olvides 
1831,0,no tengo ningún ed sólo soy una gorda fingiendo 
1832,0,ya sabiamos que a karol siempre le a traído las re ganas su mejor amigo de que putas se asombran 
1833,1, esperemos nos vale tres cuarto de verga lo que le pase mamador 
1834,0,tirar piedras sin decir nombres es lo más maricón que pueda existir 
1835,1, pues ya largate a vivir a venezuela anciano hdp orate de mierda acá solo nos fastidias con tu horrible presencia 
1836,1,si hay algo que me caga en esta vida son las pinches feas que se creen un culazo y en realidad están bien culeras y pendejas 
1837,0,no sabes ni escribir el apellido de tu 'ídolo' y sales a mamar 
1838,1,de tomar solo había tequila lo siento por todos los putos que “se les hace muy fuerte” 
1839,0,las feas leyendo mis estados y cambiando sus fotos de perfil el filtro azul de snap y creer que por tener fotos pro ya son modelos 
1840,0,escribiré así hasta que twitter me de mis putos carácteres chingada madre 
1841,0, todos mentando madres y no saben que significa cada puto artículo ya ven porqué siempre les ven la cara de pendejos 
1842,0,me gustaría que mi ropa tuviera un gps para saber en dónde verga está 
1843,0,a eso me refiero eso no está padre nadie es más o menos si dicen la palabra verga o coño o pucha 
1844,1,ya va a empezar a mamar la gorda medranoazteca 
1845,0, a ella no le gusta el chile solo el camote 
1846,0,wey que pedo con el vive ahora si se estan mamando con sus pendejas fases y sus precios x'dd no se si reir o llorar 
1847,1,la madre naturaleza no se equivoca primero acabo con los pochos en texas y ahora va por esos inútiles cubanos 
1848,0,se ve súper ridícula mi prima queriendo enseñarme a jugar billar y pierde jajaja mami yo soy la verga 
1849,0,se puede tomar como un cumplido 
1850,0,soy la única loca que con las canciones de michael jackson baila como loca xd tipo así pero peor 
1851,1,como pueden lucrar con niñosbasuras hdp 
1852,0,y esa mamada de dibujos serán código para que me hostigue la jauría rusa a mí me la pelan 
1853,0,hoy me compré un termo de varos y me tomo fotos con él antes de perderloromperlo y que valga verga 
1854,1,la liguilla es otro puto torneo alv paren de mamar así entremos de tengan por seguro que el américa se va a romper la madre 
1855,1, que no sea joto total ya se lo chingó ahora para que viene a querer disculparse pches reporteros de espectáculos son un asco 
1856,0, me duele mucho la cabeza la traducción es que me va ir de la verga con mi cruda 
1857,0,no sé si ya te habías dado cuenta pero ya se te acabó tu pendeja cabrón 
1858,0,me siento bien pendeja al defenderlo por todo lo que me hizo pero es que no me gusta que hablen mal de él sea lo que sea ni yo lo hago 
1859,0, siempre no valió madre jaja 
1860,0,creo que el halago más bonito que me han dicho es eres una cabrona 
1861,0,si tanto coraje con maire y dalas por qué tienen sus putos numeros nomames 
1862,0,pero q puso su fon en modo avión x la hueva de apagarle los datos móviles y para que no se gastasen vale verga la vida y yo angustiado 
1863,1,puto tenias que ser jajaj te queda excelente tu vestidito marica 
1864,1,la verdad es que nos vale verga si la nueva novia de tu ex es más fea gorda puta joven o vieja que tú algo es seguro es mejor persona 
1865,0,jajaja amor está niña esta loca io ni le pido fotos o algo aziii eee 
1866,0,pa que verga reproduzco en genie si sigue igual en ro me cagan 
1867,1, ah pues que hdp prefiero a ponce la verdad quién es para prohibir mejor que no ponga tantos peros y si no quiere que no venga 
1868,0,pues si se llegó el día en el que invité a una amiga al cine porque mujer luchona una futura mamá luchona y cabrona indomable como lupita dalesio 
1869,0,estos heterosexuales con unas cubitas de más se les sale lo joto jajajaja 
1870,0,güeeey porque le das rt que no ves que está mal escrito puta madre 
1871,0,está súper cagado cuando tienes toda tu música en aleatorio y pasas de arctic monkeys a ariel camacho 
1872,0,mi amigo siempre me dice que su morrita se la hace de pedo por cosas muy tontas y pues como le explico que <> 
1873,1, jajaja pinche presidente hablador si ya todo el dinero que donaron ya se lo clavó el wey y lo repartió a sus putos amiguitos rateros 
1874,0,estas loca yo novio nop gracias asi estoy bien 
1875,1,las personas que me hicieron daño en el pasado quiero decirles que chinguen su madre 
1876,0,el solecito de skype me representa bien cabrón 
1877,0,a me me vale verga que me odien todos no necesito la aceptacion de nadie mas que la propia 
1878,1,tu amiga que le dicen la cola loca y no precisamente por que pega de locura 
1879,0,mi bendición necesita que sea luchona <> 
1880,0,yo siempre voy a acompañar a gente a todos putos lados y a donde pinches yo quiero no real ya se me está acabando la paciencia 
1881,0,estoy hasta la madre de todas las publicaciones que hacen referencia a que todos los hombres son iguales 
1882,0,a las putas también las sacan de trabajar de los congales información que cura 
1883,0,hoy me puse como loca porque esto le llego a atena pero es que en realidad se ve tan hermosaaaa y estoy tan enamor… 
1884,1,que bonito es que eliminen a los putos a la jodidaaaaaaa ahora diosito por favor que mis ganen hoy y alarguen la serie 
1885,0,ya se está mamando itunes con sus putas actualizaciones diarias 
1886,0,yo preocupándome por cosas tontas y está a nada de empezar la gm 
1887,0,primero perello normalizando la violación luego sergio zurita llamando golfas por vertirse sexy y… 
1888,0, mija ya te dije que me pasó y la neta con la lluvia me agarra mas hueva y no pienso trabajar con flojera mis cosas saldran más feas 'v 
1889,0, gasolineras que no da litros de a litrohagan algolos que supervisan se hacen de la vista gorda 
1890,1,¡kikiriki hijos de sus putas madres para su mala suerte desperté vivo otra maldita vez 
1891,0,la que es payasa cae gorda 
1892,1, ok si tú lo dices si tú que twitteas sobre zapatos de hombres wow que varonil te vez eres marica guatemalteco y padre de juan diego una 
1893,0,si hablo toda pendeja normalmente imagínense peda y grifa 
1894,1,yo percibo que está bien pendeja pero es mi percepción 
1895,0,uuuugh me estoy haciendo súper tonta en estooooo 
1896,0,no hay alguna canción que se titule vete a la verga pendejo es para una tarea 
1897,0,se llevó mi chamarra mi pantalón y mis tenis basta que cabrona es me tiene hasta la verga ya que se compre sus putas cosas heeelp 
1898,0,verga como que me ando enfermando y no mentalmente jajajaja 
1899,0,la misma situación cuando te hacen el feo por ser la mujer del equipo feo porque putos bonito porque no trabajo de más 
1900,0,un amigo se compró una motoneta italika y el wey se la pasa publicando fotos como si la moto fuera su novia verga hasta le puso apodo 
1901,1, hijos de su puta madre por eso el país está de la chingada ellos por robar los ciudadanos por conformarnos 
1902,1, que pendejo eres gracias a los gringos tuvimos mundial hace años cuando nunca debimos ir pinche marica de venga la alegría 
1903,1,eres puñal seguro te enfermas a cada rato por maricón jaja 
1904,0,me puse a llorar escribiendole a mi vieja jaja que maricon que soy 
1905,0,el de mis compañeros de usaer se regresaron a sus casas por conjuntivitis de verdad que voy a volverme loca ya me pican los ojos 
1906,0, ¡madre santa quiero unos bíceps así 
1907,0,están bien feas sus fotos de arcoíris 
1908,0,está con madre tener amigas bien prendidas en feminismo y ciudad las amo 
1909,1,y todavía se ofenden porque les dicen 'putas' las muy putas lástima que no tiene twitter sino la arrobaba jajajaja 
1910,0,ay no mms según yo la hago de muy cabrona y tengo el corazón bien débil 
1911,0,hablas como una musa pero te comportas como una loca 
1912,0,a mi me vale verga yo comento los threads por que quiero 
1913,0,re duro en la parada de la plaza de la madre 
1914,0,jajajajajaja enserio no mamen con eso de que amo de verdad a la no como a 
1915,0,chile afuera entristecen todas las putas del mundo 
1916,0,guiller perales pinche joto te ves con tu cafecito jajaja me siento soñoliento en banco estatal de sangre 
1917,1, vergüenza ese hdp no la conoce mientras le rinda dividendos transas 
1918,1,putos hondureños váyanse a chingar a su madre vamos a ayudarle a los gringos carajo 
1919,0,follow me ten un buen retorno abrazo grande mi marica mayor 
1920,1, no mames bukowski era la verga no se andaba con mamadas de putas nenas como éste pinche japonés joto alv como tu pinche perro xd 
1921,0,apenas va empezando el dia y yo ya me siento como los camiones a las am hasta la madre 
1922,1,ya salió el ejército de putas en facebook y twitter justificando a luis gerardo méndez 
1923,0,es la primera vez que no hago una cagada y me fue mal la vida se empeña en que sea un hdp 
1924,0,hasta la madre de los están violando la ley en un país que no es el suyoqué esperaban y les da asquito sus países de origen 
1925,0,mi hermano me etiqueta siempre en cosas feas y asquerosas no sé ni para qué abro su notificación es como caer en videos de gemidos 
1926,0,no mamar este cambio en la rutina si hizo sentir en putisa hace mucho que no me cansaba tanto 
1927,0,gorda la critican tímida la critican linda la critican vive la critican muere era buena persona 
1928,0,estoy pensando seriamente estudiar otra carrera soy gay y millenial prácticamente estoy en la pubertad 
1929,0,hoy mis tuits serán sad porque soy una gorda que no se acepta así gorda 
1930,0, jaja es el gif más cagado que he visto 
1931,0,ben por favor me siento extra marica por este tipo de comentariosay gracias weylt 
1932,0,no mamar ponlo a la hora que nadie está despierto jajajajja 
1933,0,lo más genial deperderme meses y que ya nadie me hable es que genuinamente me vale verga 
1934,0, me pasó igual con el mio no pasó ni un puto día y vamos de vuelta 
1935,0,sofía susurra además de ser posiblemente joto es malhumorado luth lo escucha y se enoja se leva… 
1936,0,eres el que causa que sonría como loca cuando dices te quiero 
1937,1,tanto pinche dinero verga y no tienes pa' un pinche desodorante culero ¡apestas 
1938,0,no seas pendejo y si te mueres mañanate vas a quedar con las putas ganas 
1939,0,siempre que me junto con amig coincidimos que hay mucha gente pendeja 
1940,0,ni rhcp ni aterciopelados hoy mil putos contratos ahhhhh pero quieres ser don vergas no 
1941,0,que toman foto así de que “pise una piedra en el zócalo” y etiquetan todo el puto tiempo es como “ya nos dimos cuenta dude detente 
1942,1,ya deja de hacerte pendeja si bien que te quieres sentar en mi nariz de chile relleno 
1943,1,menos tu pinche prieta tiznada tu eres color ceniza 
1944,0,sabs que estas loca when comes arroz blanco con tostadas v 
1945,1,quién te manda a andar de puta y luego soportar tu título de mamá luchona 
1946,0,madre luchona que se respeta es hater 
1947,0,que putas se supone que haga si sam s y coldplay solo irán a cdmx ya que gasté mas de pesos en puros boletos de este año y del ' 
1948,0,ah por qué todo se complica en época de parciales por qué putas 
1949,0,esta gorda sigue con su novio imaginario 
1950,0,ya tan pronto mamen aguanten un poco no sean putos 
1951,1,creo que ya sé quién fue chinga tu madre y no me vuelvas a hablar nunca porque te voy a mandar a la verga como bien me sale 
1952,0, wey con tus pinches tweets estoy al pendiente de todo y hasta estoy ardida yo 
1953,0,candelas nunca maltrato a nadie gratuitamente como ha hecho miriam con yang… 
1954,0,no era gorda era mujer de grueso calibre 
1955,0,mägo de oz vuelve a méxico habrá playeras tour de cdmx a gdl mty y putas para todos <> 
1956,1,cosita querida analy se te olvidó que formaste parte de ese grupito y que te fuiste por gorda y vendida 
1957,0,que verga ser de esas personas que quieren tanto algo que cuando por fin lo tienen no lo quieren más 
1958,0,neta llevar a todos hasta el culo a la cena fue la peor decisión que he tomado siento que me van a correr a la verga 
1959,0,wey neta estás cabrona amiga el vato apenas y te habla y tu ya estás enamorada 
1960,0,no entiendo y núnca entendere a las personas que usan instagram para subír una foto de sus tacos de sus putos tacos 
1961,0,ojalá y echen a honduras en el repechaje por puts 
1962,1,que se meta con uno de su tamaño que joto ese wey 
1963,0,hoy es un buen miércoles para mandar todo a chingar a su madre 
1964,0,se han tatuado mi nombre tantas putas veces que ya no tiene ningún significado para mí 
1965,0,esa belleza no es natural pero sabes que me lvale verga 
1966,0,siempre defendía a y ya ni las palomitas son buenas todas viejas y feasme gastaré mis ptos d mi tarjeta y adiós 
1967,0,ojalá así de rapido subieran mis putas ganas de vivir que cada día que pasa se van mas al suelo 
1968,1,gracias por mandarme el correo veces hijo de tu puta madre no me había quedado claro 
1969,0,mi hermano se pasa de verga si de por sí nadie me hacía caso ahora con sus mamadas menos 
1970,0,en serio ya salieron a mamar con que coco es machista verga que cansado ser ustedes 
1971,0,iba caminando por la calle y se escucho una risa eche la carrera como loca pense que me iban a asaltar voltee y no habia nadie 
1972,0, pareja gay es agredida por jóvenes en calles de argentina 
1973,0,tenia un tweet bien verga pero tengo memoria de dory y valio madre 
1974,1,putos árbitros parece que están en contra de 
1975,0,mi vida ya había valido verga desde que no germinó mi frijol en su frasco de gerber cuando iba en primaria 
1976,0,no se como le hacen las chavas para llegar hasta con los labios pintados yo llego y luis me dice que me veo de la verga sin maquillaje 
1977,1,a deberían ponerlo con el mugroso de chema porque ese joto necesita un macho que lo domine 
1978,0,tan lindos que se verían nuestros nombres juntos pero me mandaste a la verga 
1979,0,de todo menos banda y reggaeton a menos que ya ande en la peda ahí sí ya valió verga 
1980,0,en méxico estaremos de la verga pero al menos no estamos de la verga con trump dirigiendo al país 
1981,1,ah ya escuché que es un puto niño maricon llorando porque su papá le quitó sus juguetes eso pasa cuando no educas bien a tus hijos 
1982,1,jajajaja putos hondureños no mamen es de risa esto tercermundistas del fútbol 
1983,1,los putos que criticaban a messi se cansaron de gritar sus goles hoy payasos 
1984,1, hijo de su puta madre y todavia televisa quiere su teleton 
1985,0,pero ojalá no califiquen los seguimos odiando mucho por habernos echado en de manera tan desleal putos 
1986,1,weeey que pedo puro cierre desde la semana pasado te estas mamando luis 
1987,1,pa' qué putos te sirven las pinches direccionales pinche pendejo 
1988,0, el amor a la camiseta solo se compara con el de la madre flaco 
1989,0,con telcel ni madre no quiero empeñar el culo con durante tortuosos meses 
1990,0,me puse más buena que muchas amigas de la secu jaja <> 
1991,0,rt ricardofp en esta foto putos chingones excelente show en el de manunisima te amo 
1992,0,q tetotas q se antojan mamar chupar y morder esos ricos pezones 
1993,0,si ha beses me miran solo no ando solo con mi súper y mi r no ocupó a ningún cabrón 
1994,0, te pasaste de verga sombra 
1995,1,así mero zoofilia con ti jefa y carnala un abrazo puto 
1996,0,quiero un camaro y mis padres me dicen que estoy loca 
1997,0,el que va a salir cabron de niño tiene la pinta 
