,Category,text
0,0,soy el clint eastwood de los puentes de madison en todas las putas historias de amor que me han tocado 
1,0,actualmente ya pasó de moda la pucha joto ahora sólo quedamos los verdaderos seguidores los que amamos este estilo de vida 
2,0,es cierto esto y no me refiero a lo que dijo ni al tweet sino a<>están tratando de sacarlo del programa 
3,0,vuela pega y esquiva la neta está de la vergaaaa pero es pegajosa 
4,0,mejor puto disfraz de la noche por tercer año consecutivo morros 
5,0,una verga para dejarte sin aliento y bien abierto te la tragas 
6,1,la que se veía súper mal era demi lovato porque se mamo con el escote y el peinado le quedo feo 
7,1,ya se convirtió la k en virgen maria ahora si ya esta mas loca 
8,0, y yo que creí que tuiter se trataba de ingenio y ahora nos salen con caracateres no mamar 
9,0,hoy en día ya casi nadie se muere por vih se mueren por pendejos por no hacerme chequeos continuos sabiendo lo putos que son 
10,0,me quedé sin novia sin amante amp sin ex todo en el mismo puto fin de semana 
11,0,por que critican tanto a las putas si bien que les gustan 
12,0,woou rulo invitayo tambien quiero mamar esa panocha deliciosa y clavarsela 
13,0,acosas a una chava en el metro y lloras cuando te ponen en la madre marica 
14,1,ay joto tú ahora en lo único que vienes peor que yo es en lo distraído 
15,0,iba a escribir un tuit disculpándome por todos a los que no les respondí wa en los días que no sirvió mi cel y nadie me putas escribió 
16,0,me acorde de cuando me internaron y que diego le enseño a mi mama todas las fotos feas que le mando ya son bien befis ellos 
17,0,te llevaría conmigo pero me esta llevando la verga y no quiero llevarte allá 
18,0,esa chica un poco loca que solía estar cantando por el barrio esa chica tan risueña con el pelo alborotado 
19,0,con el “agua loca” de que nos ganaron… ¡nos ganaron 
20,0,si hubiera una materia que se llamara como valer verga en la vida ya la hubiera exentado 
21,0,hasta que te diste cuenta que no te vez bien con esas cosas feas 
22,1,sólo los putos le ponen azúcar a su café porque les sabe “amargo” pinches maricones 
23,1, lo que tu no respetas es al país hdp 
24,0, pinches greñas feas te quiero amigo saludos 
25,0,de una vez ve poniendo mi foto en tu ofrenda porque ya se te murió tu pendeja 
26,0,quien tiene una rica verga con lechita y un culo para mí 
27,1,se quejan por las sentadillas del gimnasio pero qué tal cuándo se dan de sentones en alguna verga ni rezongan pinches viejas 
28,1,me cagan los weyes mamados por chocho que se sienten con el derecho de dejar regado todo lo que usaron en el gym putos artificiales 
29,0,hoy logré una asana nueva medio loca en cuanto a equilibrio y fuerza en el abdomen me siento una hippie bien ruda y feliz 
30,0,si quieren donar ropa en buen estado no putos harapos para morelos puebla y oaxaca ponganse en contacto con 
31,1, yo le hubiera soltado un vergazo en la cara para reventarle esos lentes al marica 
32,0,hoy me traje mi camisa de leñador por si alguien no se había dado cuenta que soy súper gay 
33,1,que espanto con el joto ese que generaliza a los heterosexuales por imbeciles como el es que odian a la comunidad 
34,0, estamos feas disculpe 
35,0,me acaban de reafirmar que estoy bien gorda así horrible 
36,0,cuando lo hago soy loco joto ese tipo de cosas creo que esto llegará a su final en las siguientes generaciones de hombres 
37,0,asi es bien coludidos haciendose de la vista gorda 
38,0,la verdad enojada es bien cabrona pues se metieron con lo que mas quiere que es luis 
39,0,que bonito dia y que agradable mañana perfecta para valer verga 
40,0,seguramente el brujo de apizaco está con todas las daifas meselinas meretrices prostitutas suri… 
41,1, realicen operativos para que dejen de robar el los camiones pinche bola de pndejos inútiles 
42,0,las bromas tontas siempre han ofendido la diferencia es que antes era en la intimidad de la sobremesa ahora se evidencia la ignorancia 
43,1,como mamá verga y se da de centones la muy puta y lo mejor sin condón se la chingo 
44,1,lo dice alguien que sin duda le va a un equipo marica espero no seas amer… 
45,1,hah pinche grosera marica tienes que amar los rebotes tocaron universo paralelo 
46,0,qué uno venga a clases con estas putas inundaciones y el profesor no venga 
47,1,todos los días tengo que llegar a un lugar donde una gorda pseudoprofesionista me está observando y analizado porque no le gusta que opine 
48,1,qué onda con las señoras taquilleras del metro parece que se comieron al diablo pinches locas groseras hdp si son servicio público mueran 
49,0, luchona diria yo jajajajaja 
50,1, que feas patas pero lo más feo que tiene es el alma mala entraña hipócrita 
51,0,todos los hombres que conozco han dicho que si fueran mujeres serían bien putas una lo es y no les gusta pinche doble moral 
52,0,de qué putas sirve que graben en el ultra si sus audios están re culeros 
53,0, tantas cosas feas dentro del corazón 
54,0,jeovani el puto hamo 
55,0,soy gorda o te la pongo gorda 
56,1, qqq cínica hdp vos tampoco hablaste no diste la cara con nisman y la trajedía d once sinverguenza 
57,1,girardi es la persona as estúpida del mundo la verga como putas dejas por chat tanto a robertson maldito pedazo de imbécil hijo de puta 
58,0,jaja tú estás más loca y eso dice mucho también te quiero espero echar chisme de nuevo pronto 
59,0, la luchona jajajaja creí que me ibas a besar y solo te subiste al carro a ver si no traía nada de una vieja jajajajaja ‍ 
60,1,no digas mamadas aguilera es un pendejo que hasta sus putos propios solos se le olvidan 
61,0,ok esta bien que habrán biblioteca a las que les den cobijitas pero que les den hasta desayuno y todavía hablen mal de cem que putos 
62,0,en dos meses el se va al pito y lo único que me preocupa es que debo ya comenzar a pensar en el avatar para el que putos nervios 
63,0,a las conferencias tienes que ir voluntariamente por gusto no por qué te obligan putos 
64,0,necesito conocer a alguien de mi escuela o algo que también este re loca por ruben yo no puedo seguir fangirleando sola 'v 
65,0, como luchar contra la corrupción de los oficiales no sólo nos enfoquemos en la de los ciudadanos esa moneda tiene dos caras feas 
66,1,si de verdad te valiera verga no hubieras borrado el tuit maricón hijo de tu puta madre 
67,0,que delicia ver a una mujer en cuatro recibiendo y chupando verga rt si quieres más videos 
68,0,ay chuchito perdóname por esta vida tan loca‍ 
69,1,que flojera tener novio quieren saber todo lo qué haces y opinar sobre ello si ni a mis padres les hacía caso que te voy a pelar a ti hdp 
70,0,gorda nivel me subo al elevador y se baja 
71,0,“prométeme que me vas a abrazar y no me vas a soltar” alguien que aún no sabe lo loca que estoy 
72,1,díganle al maricón de que ya no es mi chile 
73,1,el tránsito de la cdmx no es tan culero si lo comparamos con tus celos pinche loca 
74,0,todo bien digo si soy medio marica pero bueeeeeno se trata de ser adulto y no andar de rencoroso eso está más cagazon 
75,0,par de prietas deliciosos estos primos <> 
76,0,todo méxico se esta pasando a la izquierda jajajajaja no mamar en méxico no hay izquierda están los abzurdos pero nada más 
77,1, chinga tu madre ojalá te mueras puto 
78,0,si me ignoras con un hola que tiene letras ahora con un tuit de caracteres me vas a mandar a la erga 
79,0,hoy vi a una mujer usando una blusca con estampado de putos minions 
80,0, lenchibiblia jaja esta con madre sds 
81,0,violencia volátil visible violencia visceral de la verga verlos vergueársela pa' sentirse bien vergudxs perdón pero es… 
82,1,ojo aquí pinche boha alguien arróbela a la pinche putita 
83,0,cuatro putos años viviendo en xalapa y todavía me equivoco al tomar el camión maldita sea 
84,0,putas combis de tultepec en coacalco de berriozábal mexico mexico 
85,0,así mi mood laboral de hoy no entiendo ni madres 
86,0,chica sexy y nalgona excelente compañía excelente servicio de lujo 
87,1,no seas pinshi joto doble moral te odio tanto pero tanto tanto 
88,1,por qué no te abres a la verga y dejan de estar tuiteando sobre mi va si ni con los me 
89,0,pffff quiero ver a todos sus haters mamar duro 
90,0,lo que mandan en mi grupo de whatsapp quien quiere grabarse conmigo obvio yo mamando verga 
91,0,porqué todos siguen disfrazados de normalidad ¡ya es octubre putos 
92,0,ya dejen de mamar con coco y el día de muertos si no lo saca disney ustedes valiendo verga como siempre para hoy y mañana 
93,0,agenda de hoy estar de malas estar triste chingar la madre esos son mis únicas tres tareas de hoy y no me disculpo por nada 
94,0,tomarás mi alma en la lluvia a media noche mientras estoy hecha pedazos mientras me estoy volviendo loca 
95,1, tremendo hdp y así quieres ser presidente 
96,0,ya mejor mientame la madre bida 
97,1, espero y ya saquen a rogelia por joto aparte de que no sabe cocinar 
98,1, tu que putas hablas de cállate basquetbolero 
99,0,daría la salud de mi puta madre por poder meterte la lengua en ese culito mi amor 
100,1, y si tu vida sexual te hace feliz a mi tambien y chinguen a su madre los putos persinados te apoyo 
101,0,entre más corriente más ambiente cada que digan v word una verga se le va a caer a alguien 
102,0, sacó a guardado y valió madre 
103,1,los weyes ni tantita madre tienen una vez un bro me fue a recoger en el carro de su novia y yo así de déjame bajarme puto 
104,0,[noticia] karen bryson se suma a 'justice league' como la madre de cyborg 
105,0,madres que te dejan en la cola sin dinero la tensión aumenta cada vez que te acercas y tu madre sigue sin volver 
106,0, dejo al veracruzano con camote bueno salio picarona la chef 
107,0, tan mal está la delincuencia que le robaron la memoria gente tonta no saben ni a que van 
108,0,ni madres si se quiere ir que se vaya alv a rogar a la iglesia no mereces miserias 
109,0,la toma de fotos es este sábado u 
110,1, cállate tu infeliz gusana lameculos de los gringos 
111,0,rt si quieres ver la verga de este guapito 
112,1, y cuál es el problema wey la selección es de todos inche mamónvives de hacer polémica por todo chinga tu madre 
113,0, buenos diaaas a toda madreque siga lloviendo 
114,1,las buenas noches se dan no se arruinan hijo de tu puta madre 
115,0,la ra y última parte de esta rica cogidota dale rt si aguantas el dolor de una verga mezclado con placer 
116,0,todos hablan de los cerdos que comen huevo con catsup pero nadie menciona a los putos asquerosos que le echan valentina a su sincronizada 
117,0,tan pinches feas series que se pasan reimprimiendo en méxico y en eu es la mejor época para las reediciones de clásicos 
118,0,mi amor pasándola muy rico con nuestro single 
119,0,aaaaaah no si esta de la verga que llueva todo el día 
120,0,ya sigue me atl me vas a volver loca follow me 
121,0,chingas tú chingo yo chinga tu madre 
122,0,abron el sur es de lo peor en cómida y más putas careros no conocen las órdenes es taco x taco 
123,1, m jajaja esperando acá en mixcoac ya más de hora como siempre los chóferes saltándose calles que hdp 
124,0,perdón por no saber decirle que no a esta mujer la loca más loca de todas las locas 
125,0,tenía una cita con mi doctor pero la tuve que cancelar porque me enferme vale madre 
126,1,pinche tan joto por qué no le hablaste eres bien pendejo 
127,1,en serio me siento de la súper chingada putos vecinos 
128,0, y que estoy viendo la serie de lupe d'alessio y sus pelucas son muy feas y tristes 
129,1,respecto a lo de eduardo yáñez el reportero podrá demandar y hasta ganar pero lo marica para no responderle lo acompañará toda su vida 
130,1,seas mamón pinshe maty ya con ir vestido así de ridículo a trabajar es motivo de ponerle unos vergazos 
131,0,coger rico gusta pero que se los trague enamora 
132,0,creo que le voy a volver a poner cuerdas a la guitarra y me voy a poner a componer las piezas sencillas y feas que soy capaz de componer 
133,0, jajaja ya sabes muy luchona 
134,0, pues con tu cara podría ser cualquier mujer 
135,0,hoy es un buen día para votar en soribada la putisima madre vamos vota ctm ahre 
136,0,cada viernes de luchona y cabrona visitarte abuela 
137,0,ése día to nos partimos de risa porque fué el único que se salió de la housen de mi madre jsjajajajjajajjajajajajajajajjajajajajajajajha 
138,0,neta odio que me despierten porque no puedo dormirme de nuevo me caga ahora voy andar de malas todo el puto día 
139,0,esperar algo de políticos y más priístas ya valió supe verga 
140,1,me toco escuchar como mando a la chingada a la vieja que hacía que muriera de celos y la cual me nego que no tenía nada con ella 
141,0,verga para la banda dale rt y siganme 
142,0,señor ya deje de chuparse los putos dientes o lo que sea que esté haciendo se escucha en todo el restaurant no mame 
143,1,chingas a tu simia y puta madre negro pendejo para que dejen de tirarse como putas tus maricas seleccionados 
144,1,porque no piel canela tienes pinche prieta 
145,0,personas que cada que regresan alteran y vuelven loca tu vida tranquila y relajada 
146,1, vivís en lugares venís con la custodia del contry puto refugiado 
147,0,coño e su madre cuando pierdo los cambios hechos en el trabajo mierdaa puta tecnología 
148,0, es la mejor es mujer es luchona es hija es novia es abogada es mi vieja chingaoooo jajaja… 
149,0,cómo sé que ya va a hacer frío los mosquitos están más putos locos que de costumbre saben que no tardan en chingar a su madre 
150,1,no lleves a tu vieja que te sale lo joto jajajaja 
151,1,porque no les creo feos culiaos que a todo el mundo lo haya cagado un taxista 
152,0,algún activo de la cdmx que me quiera dar bien rico soy y me encanta vestirme como golfa 
153,0, todas son putas hasta que demuestran lo contrario quién fue el autor de esa gran mentira 
154,1, chinga tu madre ratero de mierda eres un vulgar populista retrógrado 
155,1,todos putos por no desaforar a tarek el miedo no anda en burrotodos son un asco 
156,0, pero el camote no engorga bueno en ocasiones si 
157,0,la banca en méxico esta viendo la propuesta de regular esta moneda para comenzar a invertir en ella va a subir su cotización pero cabron 
158,1,a me dejaste en seen pues seenga tu madre 
159,0,putas canciones que se convierten en la máquina del tiempo 
160,0,ha sabido liderar a un gpo que a pesar de las cosas feas lo ha manejado muy bien y sigue siendo un muy buen lider 
161,0,estoy loca por los gatos 
162,0,con esa cinturita y culito empinado cualquier activo se da su buena atascada con estos culos jejejeje 
163,1,no me he relacionado con muchas personas y como me cala que me recuerden a ciertas morras porque alch están feas y se burlan de mí 
164,0,se la pasan mamando verga con que en medicina está lo mejor de la universidad pero no son más que mentiras 
165,0,no señora tomarle fotos encuerado a un joto y después cogértelo no te hace fotógrafo 
166,1,te estás mamando villalord te estas mamandooooooooooooooooo se sale del grupo de whats 
167,1,jajajajaja mejor que vaya a prohibir a su casa a los deportistas q los deje empaz vieja loca 
168,0,mmmta pues no veo ni por qué tendrían no te he visto ni chancear una sola vez nada que ver gente loca 
169,0,de haber sabido que iba a incomodar y que significaba mas lo que hiciera cualquier pelado no hago ni putas madres puros pinches corajes 
170,0,esta semana me espera estrés llanto enojo desesperación y resignación putos exámenes muéranse mejor 
171,1,pinche marica te he de ver en el whatsapp jajajaja 
172,0,a mí no me gusta compartir estos rollos como si fuera chistoso siento que perpetúa un discurso misogynistoriented… 
173,0, jajajaja no mames estás cabrona woe 
174,1,no mames pendejo con eso no se juega pinche lobo puñetero bales berga 
175,0, cuando eres hermana hija madre padre abuel amig tóxica y luchona a la vez 
176,0,cualquiera en su sano juicio de habria vuelta loca por ti … 
177,1,pinches modas puro maldito pantalón skyny para puro hemo marica maldita sea 
178,0,estoy cagada de miedo pero si todo sale chingon les invito whisky coca y putas 
179,1,deja de mamar putito y cuando no les vendieron ustds boletos en la final a las gallinas no estabas chillando 
180,0,mi madre me abrazó y fue hermosoquiero más abrazos 
181,0,me acabo de dar cuenta que las personas feas se juntan con personas igual de feas… 
182,0,adivinen quien mariquita estaba viendo parte del tour barcelona del y termino llorando si esta mariquita 
183,0,apoco si me veo bien loca si le digo que hoy cumplimos un mes de conocernos 
184,0, yo si y no es prieta ni prietita totalmente clara 
185,0, que ustedes se pesquen de la verga de un mosquito para ofenderse es otra cosa frase célebre de en una camiseta que diga 
186,0,lo necesito no me puedo decir gorda profesional si no tengo unoooo 
187,1,mira compa a ti que te valga verga si esos putos no pueden hacer lo que tú deja que les arda la envidia 
188,1,hasta nunca putos chilenos a vivir del y a la camita a ver el mundial a mamar borracho 
189,1,como el maricon me cogio pero se la cague el consuelo del maricon 
190,0,ahora sí sentí que valía verga y nos asaltaban necesito diez bolillos para el susto 
191,0,creo yo quemala madre no he sido 
192,0,ahí les hablan a los putos que basan su vida en whatsapp 
193,1,que bien te ves con esos filtros hasta pareces albina ¡hija de tu puta madre prieta 
194,1,atención aquí viven los que nos asaltaron en un taxi a mis amigos y a mí prendieron mi iphone 
195,0,a los rojos y a los azules les van a mentar la madre hasta para llevar 
196,0,igual que tu te lucras de las mierdas de wismichu metiendo putos anuncion en el video venga no me jodas 
197,0, like si valiste madre en tu primer día de clases y prefieres un sugar daddy jajaa 
198,1, jajajaja tu mamá aparte de luchona naca y americanista ocurrente la putita 
199,0,neta que es una gran cosa hacer todas las tonalidades con la boca y esos tres putos botones inténtale 
200,0,acaso como ciudadano no estás hasta la madre de escuchar de fraudes saqueos corrupción y violencia que vive méxico 
201,0, la pobreza es cabrona mai frend no es por mala onda yo nomás me compré ese libro hahahaha 
202,0, uff palenque se pone cabron ahí disfruta yo el viernes a ver qué tal está 
203,0,ando bien caliente solo de imaginar que me como tus labios 
204,0,neh está de la verga mejor mándame a mia khalifa gg 
205,0,confieso que últimamente me vale verga todo 
206,0,me choca estar en mis lady days y sentirme como señora gorda de mercado sude y sude y siempre con un papel para usarlo como abanico 
207,0,ustedes son los que provocan el pinche desmadre si ya cierran y no avanzan para que putas vuelven a abrir las puertas 
208,0,ese momento en el que juegas y debes hacer una elección de esas feas los odio k 
209,0,ayer conocí a una chica que se llama vida y lo único que puedo pensar es en lo cagado que será cuando muera 
210,1,deja de mamar pinche vieja meca este twit hubiera estado perron hace horas ni pedo 
211,0,las bonitas somos solteras por decisión propia las feas pues por feas 
212,0,no se pasen de verga jajajajaja quién putas escucha hey tú muchacha linda ven dameun beso me cagué de la risa 
213,0,si pero no se quejan de que no los apoyaran solo les dicen putos es todo 
214,0,ya vimos coco sí es una maravilla de película no lloramos pero nos dieron ganasy lo mejor no vimos el puto corto de frozen 
215,0,no te pases de verga si aparece twisty el payaso 
216,1,tantita madre ‍ las de méxico están mejor hechas y más baratas 
217,0,gorda nivel va a tragar tamales al gym 
218,0,ando que me lleva la verga literalmente 
219,0,si te encuentro así en la noche si te la ando mamando rico jejeje 
220,0, insulte a los que no ponen sus putas direccionales 
221,0, alguien puso un post muy pendejo en feis y escribió y la neta se me hizo cagado soy muy simple 
222,0, no me gusta ese rectángulo hacia abajo que se ve en el medio del kit es como una tipo de arruga o no se en no se ve eso 
223,0,amigos tienen que leer esta puercada está muy pasada de verga 
224,1,si te tienes a ti mismo de fondo de pantalla eres lo que le sigue de joto 
225,0,sueño con el día en que… ¡ah no mames ¡verga ¡verga ¡es hoy 
226,0,si no te suma que se vaya a la resta digo verga 
227,1,ya saquen a esta pinche vieja ya cae bien gorda con sus payasadas parece prostituta 
228,0,chiste chiste cuál el el colmo de un joto andar con un mecánico y que le truene la reversa 
229,1,ahora en la noche tocará ver perder a los putos yankees 
230,0,como diría el ezequiel a mí me vale verga porque todos me pelan la verga alv v 
231,0, disculpeme pero las buenas noches a tu lado son feas tu eres la hermosa con esos obos que parecen estrellas y esa carita que parece laluna 
232,0,su pinshe madre está cabrona la inundación me tocará dormir aquí en la gasolinera 
233,0,amigos y conocidos se la viven en la peduki loca y uno que ya dejó el alcohol por la paz v 
234,0,no mamarya le dieron la vuelta los a los 
235,0,se emputa cuando alguien le dice algo y para acabarla de chingsr azota todas las putas puertas de la alacena y le vale verga todo 
236,0,bue me voy a poner a hacer algo de mí vida igual no voy a cursar ni loca porque van a hablar del hippie y no quiero escuchar boludeces 
237,1,ni una semana en operaciones y ya salió la gorda ridícula que propone ir disfrazados a la oficina en halloween 
238,0,primera vez que me dan asueto el día de muertos y yo de viaje de trabajo no mamar 
239,1,con ganas de decirle siempre fui realista a ti nunca te prometí nada pendeja si me fui de tu vida fue por que no sabes querer 
240,0,qué horrible ser mujer y tener que vivir cuidándote de todos los hombres que se te cruzan 
241,0,tenía rato que no veía a bolillo tan feliz verga 
242,0,le acaban de decir a mi mamá “está bien bonita tu hija ha de ser bien noviera” wtf gente 
243,0,pues el diseño chido pero eso de dos mentes brillantes sí que te la mamaste compa… 
244,1,viejas pendejas muchas pero más con la que vivo me cae bien gorda 
245,1,ahh que verga le vas a asegir chupando las bolas alos pateticos no son nada al lado de mexico wey 
246,0,osea de por si las putas universidades te roban de todos los modos posibles y ahora también la cédula sera tramite exclusivo para ellos 
247,0,mi madre siempre consintiendome 
248,0,ya chingo a su madre este pedo 
249,0,solo voy a comprar el boleto de la tnt para ir por tu autografo y para reclamarte mis putos dulces que nunca me han llegado gtv 
250,0,ya no curaré tu soledad cuando duerma la ciudad no estaré para oír tus historias tontas 
251,0,me caga que mi enojo se convierta en llanto que marica 
252,1,te voy a matar pinche maricon asqueroso mejor ni pises el aeropuerto 
253,1, claro desde putos narcopolíticos ignorantes para empezar los mas ratas y chairos es lo primero que deben de señalar pendejo medio vendido 
254,0,nos valió verga y no entramos a la clase del oompa loompa 
255,0,madres lo gorda que estoy 
256,0,a mi me gustan tragones que me den helado si me pongo loca 
257,1,increíble pasan los putos simios tercermundistas hondureños y eua no va al mundial solo tiran patadas y hacen tiempo antifútbol 
258,0,es depresión o tal vez estrés pero neta no tengo idea de que putas traigo 
259,0,es gracioso cuando te das cuenta de que está intentando hablarte con excusas bien tontas como sabes para cuándo es la tarea 
260,0,jaajjajaajajjajajajaajajjajajaajajajaja te pasasvoy a quedar loca de tanto bullyng psicólogo 
261,0,ya que se acabe el soy un mar de lágrimas no mamar 
262,0, o muere al ver a la luchona sobresalir 
263,0,al ver esa imagen de juro q me descontrole terrible grite flippee pero gra culpa la tuvo una amiga q… 
264,0,no entiendo para que me decías cuídate mucho si al final fuiste tú quien me dio en toditita la madre 
265,0,solo el amor de una madre apoyara cuando todo el mundo deja de hacerlo 
266,0, ya me hicieron llorar putos 
267,1,me recai que si leyeras mis tweets te enamorarías más de mí hija de la verga 
268,0,sabes que ya valió verga cuando los niños te dicen señora 
269,1, no tienen puta madre esos putos 
270,0,se inundó bien cabrón por donde vivo y se me hizo súper tarde para el trabajo 
271,0,la misma gata pero revolcada 
272,0,a mí una vez me escribio en grindr supongo es fakeporque en caso sea gay no se me hace de los tipos… 
273,0,a veces me pregunto por que estoy tan loca literal 
274,0,cuando pongo un tema de me siento como si estuviese en un antro lleno de putas drogas y alcohol siendo el rudo del trapeador 
275,1,que asco de personas solo son unas ratas que hablan a lo pendejo chingen a su madre los del pan y los que ya no son del pan putos 
276,0,una cosa es quererlo ver y otra es llevar tu sillitano mamar 
277,1,en el mismo en el que vas y chingas a toda tu puta madre 
278,0,estamos atorados en una pinche inundación en pinches tultitlán vale madre 
279,1, si este hijodeputa quiere ayudar debería ser completamente invisible al hacerloigual que su bola de secretarios lameculos 
280,0, super luchona y determinada te confundes con facilidad abierta a nuevas ideas platillo favorito elotes num de la suerte 
281,0,le hacen mucho a la mamada si todo el partido no han jugado a nada ya clasificaron y ya vale madre chavos 
282,0,dejen de mamar con su puta marcha lenta está pendejada ni avanza 
283,0,día viviendo en toluca el clima está de la chingada 
284,1,si vas a proponer pendejadas mejor no hagas ni madres y dejamos que el albañil diseñe morro pendejo sin noción de diseño o funcionalidad 
285,0,soy la única a la que la vida no la quiere 
286,0,pizza gorda porque hipster cualquier lugar con horno de barro las preparan 
287,0,cuando ya liberaron los caracteres pero nos encanta estar mamando 
