,Category,text
3431,0,una vez un viejo me preguntó la hora así de la nada y gritando verga cómo me asusté pero igual llevaba prisa 
3432,0, enfrascado en su berrinche le vale madre que se incendie la panaderia en su obsesión por el está destiñendo al pan 
3433,0,no lo borré no c qué putas le pasa a mi celular me enojé 
3434,0,pague infracciones del bmw y lo lleve a verificar esta vida loca 
3435,0,jajajaja quien gana el marihuano vs el camote <> 
3436,0, que rico mamas el camote tieso baboso y preñador puta panochona toma tus mequitos bb 
3437,0,las tontas siempre creerán que son las únicas sobre la tierra 
3438,0,si me dieran pesos por cada vez que me dicen “te deberías comprar un coche cómo ese” ya tendría mi puto coche 
3439,0,a un lado mío va sentado un joto que está escuchando corridos jajajaa 
3440,1, haz de estar bien prieta ‍‍ 
3441,1,ayer me acorde de ti y eso curiosamente cuando vi a una perra dejandose meter la verga por un perro mugroso cualquiera como tu igualita 
3442,0,no le queda grande el cargo la estatura no define la inteligencia 
3443,0,el culo qué tienes corazón el corazón estoy cansado y muy lastimado elculo se mamo 
3444,0,mmm q rico se ve ese culito q se antoja mamar chupar y con la punta de mi lengua hola 
3445,1,ah verda putos que creían que mauricio sentaba cabeza en puro chacal o que 
3446,0,mis manos sudaban al entrar al auditorio y we las limpiaba como loca monsta x comeback in november 
3447,1,maricon inyectado con esteroides un hombre se disculpa de verdad busca al reportero y pide disculpas 
3448,0,no tienen idea lo mucho que me encanta montarme sobre una verga sobretodo si me la meten por el ano 
3449,0,escort privada – ejecutiva – odalys fotos reales 
3450,0,ver otra vez las tontas no van al cielo me hace buscar todas las canciones pop sad de su soundtrack 
3451,0,así es equis no pasa nada la neblina me la pela vámonos al antro equis 
3452,1, hijo de tu puta madre quien te crees para ponerme así de tristirijillo josé josé 
3453,0,sé buena y llorarás sé cabrona y llorarán por ti 
3454,0,pues ni gorda ni buena 
3455,0, jaja cuando en su bio ponen loca bipolar es muy cagado 
3456,0,esta semana es de desmadre perdóname diosito por esta vida tan loca 
3457,1,vale verga tenian que ser en miercoles putas chivas 
3458,0, siempre hay tiempo para darse en la madre por alguien‍ 
3459,0,tomarle fotos feaschistosas a mis amixes me hace experimentar un placer inexplicable 
3460,0,papito que rica verga quisiera tenerla en mi boca para deslecharla 
3461,0, jaaajaja no cabe duda por algo eres mi mate jajajaja sería muy cagado que entrenaramos juntos ya sé yo andaba con el dedito levantado 
3462,0,qué difícil ser yo madre luchona servidora pública ama de casa y sin poder darle la mejor calidad de vida a mi perrhijo sin croquetas 
3463,0,cómo pudo ser tan tonta y olvidar que es lo que importa 
3464,1, esto debería castigarse con cárcel hdp 
3465,1, pinche tronco es mas malo que la chingada este wey de regalo juvilenlo o algo asi xq con el la defensa no vale para ni madres 
3466,0,me encanta lo odio me pone roja y luego lo quiero mandar a la chingada ahh el amor 
3467,0,madre mia khe ace aki kompañero x segundo dibujo 'v 
3468,0,no sé si me voy a ir al cielo en mi salón había una santurrona que nada más probó la verga conmigo y se fue como hilo de me… 
3469,0,me cagan los putos dramas amiwos no sean así porfi 
3470,0,me estoy durmiendo bien cabron necesito mi cama dormirrrr 
3471,0,una pelicula contemplativa para darnos un buen jalón de verga antes de salir de la cama 
3472,0,chile puta madre cómo fuera del mundial los putos dioses de latibo amércia weey 
3473,0,ya valiste verga cuando le pones un tono personalizado a sus notificaciones 
3474,0,tengo mucha tarea y la tengo que acabar hoy porque mañana toca party loca 
3475,0,no puedo ver el documental de demi porque sé que voy a llorar como marica todo lo que dure y ay 
3476,1,ya dejen de estar chingando vayanse al md putos esta por estallar mi cel ’v 
3477,0,ando tan fresco que me voy a trabajar en pants chingue su madre p 
3478,0,por qué las amistades hoy en día son tan feas 
3479,0,a mi siempre me ignoras y siempre te mando mucho amor quiero que sepas que cumpli mi promesa y que estoy loca por… 
3480,0,comooo me cagaaa que digan que son putos en vez de son gays 
3481,1,que feas greñas tiene esa niña ay dios 
3482,1, hasta trump que no da una esta vez llevaba sus botitas de machorra 
3483,1, muchas gracias qh pásale tú también a chingar a tu madre taf 
3484,1,esos de no tienen madre cancelan vuelos por el huracán lidia y te cobran penalización y cambio de tarifa 
3485,0,elliot se mamo con el documental está bien verga 
3486,0,cmoralesd moncruzpinto ivanovax me la pelan pinches horrendos 
3487,0,como se azotan por la palabra verga peores cosas los he visto haciendo y diciendo así que no mamen 
3488,1,políticos pseudoaficiomados que sólo en finales hablan de beisbol pueden ir mucho a chingar a su madre y peor cuando opinan 
3489,0, “es que imagínate qué tan atractiva es una boda si le dices a la gente 'no hay misa putos es directo a embriagarte' 
3490,1, es ese del le gusta el así son los q traicionan a sus anda de el 
3491,1,no le queda a la putita tiene la misma cantidad de dignidad que daniela madow 
3492,0,ay qué tenis tan culeros le dieron al chuky me lleva la verga de esos de paca de outlet 
3493,0,hola tenia tiempo que no me conectaba pero ya regrese con fotos nuevas 
3494,0,me siento demasiado estresada y ansiosa me vuelvo loca esperando quiero a mi isa ya 
3495,1,asociación de futbolistas ¡pinches putos si quieren también pónganse vestidos y tacones 
3496,0,lo malo de estar ardidas que le tiran a lo que sea con tal de seguir jodiendo 
3497,0, ya m tienen hasta la madre esos maes 
3498,0,me encanta la gente que en lugar de pensar que estoy loca me siguen la corriente en mis tonterías 
3499,0,se apendejo pero no era para tanto doña lucha no se tenía que ir 
3500,0, jajajaja cabrona nos hiciste reir a los que venimos en el auto jajaja 
3501,0, y mi cumpleaños cabrona 
3502,0, porque todos sabemos que está ahí porque es el que le revuelve los frijoles al otro anc… 
3503,0,gorda nivel mi mamá me esconde la comida que le pasaaaa 
3504,0,yaregresaron las putas de colosio y los infigentes frente a la delegacion y ya regerso luna y monrata mas vilezas 
3505,1,jajajajajajajajaj escúchala gay 
3506,0,pta madre olvidé el rivotril 
3507,1,las mujeres que están bien pinches hermosas la verdad tienen derecho a todo putas feas mejor guarden su opinión en el culo 
3508,0, estas cagado y te pueden detenercerca de la sentencia de los narcosobrinoscreo que allá no llegas 
3509,0, jajaja no wey doña lucha no la mamá luchona de veracruz 
3510,0,eres gorda cuando usan lo del peso como último recurso sabes que no tienen nada más 
3511,0,me encanta el beso negro y clavar mi verga en lo estrecho de su ano 
3512,0,ya que estamos hablando de locas tu e res loca y media 
3513,0,esta cabrón este tipo <> 
3514,0,oye voy a viajar el a méxico así que espero que llegues el a mid y vivir la vida loca 
3515,0,ya la me vale verga mejor ahora antes de planear boda 
3516,1,pinche mamá luchona es muy castrosa 
3517,0,its a secret hasta que sepa si es gay o no jajaj 
3518,0,uaem niega fraudes de la estafa maestra “está más limpia que la madre teresa 
3519,1,desquiciado está el pendejo que se mete en la vida personal más allá de su trabajo que le importa al maricon ese 
3520,0,qué fácil le decimos a alguien gorda joto naco puta etcétera y qué fácil olvidamos cuanto cabemos en una de estas absurdas categorías 
3521,0, lo mismo dije ya le partió la madre al medio campo y como fue 
3522,0,tirales sus putos aparatos a la verga ahí que se den cuenta que no has pagado para que te visiten 
3523,1, y nuestros putos rateros políticos mexicanos comenzando por donde están solo ven por sus beneficios 
3524,1,veronicalderon siguen vivas porque estan bien pinches feas 
3525,0,gracias al feminismo ya sabemos que a la mayoría de las morras les gusta tanto como a los vatos decir verga ya sabemos ya sabemos ya sabemos 
3526,1, otra ardida por dios denle un bozal a todos 
3527,0, si estuvieras aquí podríamos valer madre juntas 
3528,0,lo feo de ser diferente es que tu papá cree que estás loca 
3529,1,que si estos que si lo otro… qué pinche valor tienen para hablar y decir mamadas ya no se hagan de la vista gorda malditos imbéciles 
3530,0,matematica y la re concha de tu madre ahre q todas las materias son unas mierdas 
3531,0,igual que siempre el dinero tarda en llegar pero a su puta madre como va corriendo de nuestra billetera y nuestras tarjetas de nomina xd <> 
3532,0,encontré a una amiga que es igual de droga y pendeja que yo y la quiero mucho 
3533,0,viborear a las que son “gordas feas y pobres” y estar ídem 
3534,1,me caga que los putos heteros se traten de defender con un argumento mediocre como “es solo internet xd” 
3535,0,llevo dos semanas haciendome tonta en el gym y hoy ya lo estoy notando real me quiero morir 
3536,1,este cabron se pasa de culero ando con unas putas ganas de ponerme impertinente que no mamen 
3537,1,para qué ponen un chat si sus putos asesores no lo atienden y su pinches números no los contestan ineficientes 
3538,0,wey en españa the hangover o qué pasó anoche se llama el resacón verga 
3539,0,si lo tengo que pedir no lo quiero y si no te nace pues a chingar a su madre 
3540,0,cuando alguien tiene el poder de hacer lo que sea con una cuenta ajena lo primero que hace es escribir soy puto hasta para eso son tontos 
3541,1, no tienen abuela madre vergüenza 
3542,1,que bellas y ricas se ven para para ponerlas a mamar mi verga mamá e hija y juntas la chupen 
3543,0,se ve delicioso como le empaste la verga a ese suertudo 
3544,0, algo bien cagado jajajaj 
3545,1,si quieres venir a darme órdenes paga mi nómina de cualquier otra forma vete a la verga 
3546,1,son unos putos ratoneros más pinches niñas que nada 
3547,1,no sé si entre más prieta más intensa y grosera 
3548,1,es difícil creer lo que cuenta esta pinche gorda depresiva 
3549,1, mejor chingas a tu madre tu pendejo 
3550,1,llora por el penal hijo de perra como lo hiciste en la final o solo cuando quedas mal lloras maricon vende humos 
3551,1, nada más de paseo hijo de tu pinche madre y los mexicanos aquí trabajando para mantener a tu perra familia 
3552,1, que se lleven a su madre a ver que se sienten hdp 
3553,0,creo que tengo un poco pesada la mirada o es la actitud de ni madres me vuelven a robar el carro 
3554,1,gente y q opinan de maricon del q es un inrespetuoso deverian demandarlo marica 
3555,0,tampico playa bagdad y se me hace que me estoy mamando 
3556,0,oh si comprobado y confirmado aunque sudes la gota gorda 
3557,1,que putos haters 'c no saben la buena comedía lo as intentado 'c 
3558,0,que cagado cuando alguien pierde el atractivo y dices verga 
3559,0,la vida es para ser la verga no para sentirse orgulloso por valer verga en todo padrinos 
3560,0,no soy celosa sólo tengo un sexto sentido para distinguir putas 
3561,0,no colega no las conozco me las podría compartir uta ya para ese momento sabía que la había cagado contesté para cagarla aún más 
3562,0,que putas esta pasando con sl es en serio disney 
3563,0,a mí no me hacen tonta solitas se hacen tontas 
3564,1,tu no por qué eres machorra 
3565,0,nel tan bailando regeton o lambada no me acuerdo jajajaj el ingles parece marica el argentino parece arrabalero jajajasj 
3566,0,no puedo ser tantito joto porque los tacones me matan y me lleno toda la ropa de mi base de bissú 
3567,0,una noche loca barezzito in miguel hidalgo df distrito federal 
3568,0,yo hoy me levanto hasta las putas am mi cuerpo ya son las y ni creas que duermes un minuto más 
3569,0, regálame un bajo o un combo para bajo we plis qué ha sido lo más cagado que te ha pasado en un tokin 
3570,0, jajajajajaja te lo juro que no fue así pero resultó más cagado aún 
3571,0, cagado como los fanáticos d juanita andan chillando no hace mucho iban a ser parte del panis… 
3572,0,me haces la más feliz grite como loca aún que no lo veas fav si rix qué lindo eres al tomarte el tiempo de se… 
3573,0,estoy desayunando y la gata está sentada al lado de su comedero poniendo los ojos del gato con bota es tan gorda e hdp como yo 
3574,1, a ver si después no t sacan con el argumento que le mentaste su jefecita al arbitro puñal y te digan que no puedes ni chiflarpagando ticket 
3575,0,me encanta escuchar los casos de la mano peluda soy fan aunque sea bien marica 
3576,1, no que poca madre tienen solo les vieron la cara a estos damnificados hdp 
3577,0,oh yoyoyoyoyo yo el que no brinque es wuilo maricon 
3578,0, a mi los ewoks me gustan son pequeños y peludos y tienen ojotes ah y la trilogía original d star wars es una reata grande y gorda 
3579,0,mi con sus frases de señora luchona 
3580,0,jajajajaja lo dejo como para que ya no vuelva a buscar verga 
3581,1,pinches chichis feas y aguadas eso no es objeto de orgullo <> 
3582,0,porque ha unos que si son unas putas y tienen novio y sobrepasan el desmdre en tuiter 
3583,1,acomódate los putos lentes pinche marrano pareces anciano y no interrumpas los comentarios de los que si saben pendejo 
3584,1,guerra de estados baiganse todos a la berga me bale berga prros y jálense hijos de su puta berga me bale berga prros 
3585,0,rectificar es de sabios el ya mando a la burger al ame 
3586,0,con el numero que aparace en cada foto es el numero de la chica hay que marcarles cada una maneja diferente horario 
3587,0,apple entendió que la gente quiere cada nuevo iphone no por las tontas funciones que le añadan sino por la imagen que proyectan al tenerlo 
3588,1,ya oyeron perras se respeta ya los amigos no respetan putas zorras 
3589,0,siempre que uno anda en sus días tiene una melancolía vine cabrona 
3590,0,les puedo decir pocas cosas de lo que vi e hice hoy sólo les aviso que en regalaremos pases para la premiere de ¡madre 
3591,0,amo que nepo ya no me haga caras feas cuando perreo lt y yo he aprendido a escuchar sus rolas de dragon ball 
3592,0,ah cabron según yo me gustas y me encantas siguen siendo las mismas dos putas palabras 
3593,0,me informa mi hermana que una gorda la acuso formalmente de promover la anorexia 
3594,0,aaaahh pero las putas hormonas tenían que atacar 
3595,0,muerdeme la piel ven y pierdeme el respeto 
3596,0,nuestro hay marica te amo eres una gran persona neta 
3597,0,marica me traume es que regalame es perfeta 
3598,0,si con pinches caracteres me eran suficientes para mandarte a la chingada ahora con el doble ya pasaste a chingarla pero bien bonito… gracias twitter por la bella oportunidad 
3599,0,regresé perritos y ando muy cachonda asi que quiero verga 
3600,0,después de ver creo que alguien en debe estar muy decepcionado por sus películas sigue siendo el puto amo 
3601,0,no es lo mismo que no es lo mismo la esperanza del que estar hasta la madre del cambioincluyendo sus voceros 
3602,0,dicen que luce sin haberlo jugado igual que el no sé si esperaban dinosaurios la master sword a cloud o qué verga 
3603,0,ya desperté y miren como desperte con la verga dormida y yo queriendo follar alguien gusta despertarme mejor 
3604,1,parce marica webon ver a este par es lo mejor youtube ya te extrañaba y nosotr también 
3605,0,vivo en un país donde el ser mujer te pone en riesgo en donde todos se hacen de la vista gorda para no tener problemas 
3606,1,tan de la verga está la selección argentina que hoy debutó darío benedetto 
3607,0,la vdd si me grabe pero ni loca lo subo jajsjajsjaj 
3608,0, rt y subo otra foto completa con mi verga parada 
3609,0,si no te busco te valgo madre 
3610,0,enséñame tu ano quiero lamerte antes de meter mi verga 
3611,1,amiguitos no tengan novias pendejas putas como sea pero pendejas 
3612,0,me enfurece ver que la gente se trague los putos tacos de tamarindo 
3613,0, que se vallan ala v lo que te mientan la madre no vivirán en la mansión con nosotros 
3614,0,tantas putas horas para esperar al mejor y lo cortan cortan la mejor parte 
3615,0,road trip por la sierra gorda de querétaro 
3616,1,jajajajajaja ¡váyanse a la verga y dejen mis kilos de más en paz 
3617,1,con esta descarga dentro de la concha de está putita juro que queda preñada 
3618,1,no mamen ni jugando como jugamos en el barrio pasándola a todos les ganan a esos putos 
3619,0, no te equivocabas mi madre y tu tenían muchísima razón siempre es mejor lo que viene 
3620,0,aiiiiiñ mi hermanito no es joto sólo que dice que no le gusta caminar entre tanta gente como quiera te amo oma… 
3621,0,entonces que andas de vieja quemando a otros cuando tu estas igual das pena… 
3622,0,tengo tu foto para volverme loca con el corazón roto 
3623,1, puto argentino quedate en costa rica mamador demeritas el juego de méxico chinga tu madre 
3624,0,no puede ser ahora quieren que sea filósofa jajaja porno no mamar 
3625,0,y hasta dicen gay porque los leones podrían ofenderse paren de mamar un ratito porfa 
3626,0,alaqueonda estoy gorda y sigo comiendo como si no me importara 
3627,0,porque una cachetada es medio marica los hombres dan putazo seco 
3628,0,la madre naturaleza se cobra tanta estupidez 
3629,0,jajaja es que amaba mi cabello rojo no se que putas hice 
3630,0,en draft soy de la idea de ir por el ot q hace falta pero si… 
3631,0,weyyy que asco con eso acaso fui la única que noto eso en su pic o qpdo quedé re loca así 
3632,0,cómo le explico que mis tuits no son para el y deje de mamar 
3633,0,no violan les gusta el porno en el que humillan a la mujer no matan infantilizan a las mujeres no pegan insultan con gorda asquerosa 
3634,1,que putas ratas miserables tienen que ser para vender cortesías del partido 
3635,0,verga no me hagan aparecer en mi tl personajes sexistas maigues como esta mujer gracias 
3636,0,mamando su grande verga de este negro oort para que no elimine este video en hrs fv si te gusta verme mamando verga ht… 
3637,1,no pero ahora imagina como le va al niño que su mama va vestida como golfa crees que los otros niños comprenderán o eso no importa 
3638,0,hoy mi hermana fue a la firma de autógrafos que dio aquí en xalapa cuando llegue de la escuela estaba como loca buscando mi celular 
3639,0, no manches lo pienso y está cabron 
3640,0,está muy buena y pues nomás está chido mamar con eso 
3641,0,o al menos procurar que no salgan más putos barros alv 
3642,1,qué te valga verga si me fumo un puto fili bebé por q con dos me quedo visca 
3643,1,cual fuera de juego árbitro hdp asensio partía de posición correcta bale estaba adelantado pero no participa valla gol nos han anulado 
3644,1,deja de contar tus mamadas y mejor dime si me aguantas un tiro pinche joto 
3645,1, vete alv arriba las chivas puto 'v 
3646,0, tu no tienes que dar explicaciones a esa gente prangana y prieta saludos desde el reclusorio oriente hermosa mujer eres 
3647,1, jajajaj putos mamadores siempre me hacen el feo por fresas jeje yo soy hijo del pueblo y rey del queso de puerco y lo digo sin miedo 
3648,0,renunciemos a los trabajos y vivamos todos la vida loca 
3649,1,putos bis me quitan a mis chicas porque son bis viste uh que asco los bis 
3650,0,frente ciudadano yo veo putas banderas de partidos qué mal que sigan pervirtiendo las palabras 
3651,0,acabo de enterrarme la uña en mi pierna de la forma más tontatapándome 
3652,0,ay esta chaviza tan loca gracias por resolver mi duda existencial 
3653,1, a de ser pueblo de putos empenzando por ti pinche lameculos 
3654,1, ya sé a mi tmb te quería regalar el mio lo infecto un desgraciado con sus manotas y no lo quiero cerca pero menos que se lo quede el hdp 
3655,0,las feas que se toman millones de selfies ‍ 
3656,0,supongo que yo seré una loca para ellas alguien que no quiere cumplir con su papel de mujer buena 
3657,0,otra otra noche otra otra otra noche otra cuéntale que beso mejor que él cuétale que te traigo loca cuétale que tú me quieres ver 
3658,0,ya ando bien lupita d'alessio y me siento toda una mujer ultra luchona 
3659,0, así parece monreal fundara su partido prieta y todos felices y contentos 
3660,1,dalas oculto su subs y se esta llendo ala verga xd y wismichu mata a botellasos putos españoles valen verga xdxdxd 
3661,0,más por la trayectoria q tiene la chilindrina esto el final si da medio miedo xd la hacen como una loca 
3662,0,hoy recorrí la capital la sierra baja la altiplanicie pulquera y la sierra gorda de hidalgo 
3663,0,el papa jugaba tiro al blanco con la sirvienta hasta que la mato y este culerete maricón le gusta marcar mujeres co… 
3664,1,jajajaja real muy gata para mi gusto 
3665,1,pinches gatos les hablas para reportar borrachos violentos y no van ah no los graves porque les crecen los huevos y piden apoyo putos 
3666,0,dejen de mamar con sus carácteres de igual modo los van a seguir usando bola de payasos 
3667,0,si garcia marquez escribió “memoria de mis putas tristes” estoy en todo mi derecho de escribir “memoria mis putas locas” 
3668,0,es lo mas rico que he visto un gordo godinez con verga gorda y huevon nuevos aportes 
3669,0,pues x q el jaguar es sexy tiene mirada de mata putos sus tatuajes le van muy bien y tiene un bell… 
3670,0,las tetas más ricas quiero meter mi verga entre ellas me dejas 
3671,1,que les quiten la luz a esos hdp sólo la usan para clonar películas 
3672,1,donde quieras putito a la hora que quieras te da culo a la oficina que vayas la mía está en satélite mi querido chavo ruco 
3673,0,tengo pegada una canción de bad bunny ¡verga verga verga verga verga ayuda 
3674,1,todos los dias te oigo y conozco tu linea todas las que te atacan son las pinches golfas que no piensan en sus hijos te apoyo 
3675,1,que se cancelan dije me vale verga si no nacen más pinchis bebés igual ya hay mucha gente 
3676,0,ni madreses su letra mi chuy nada como que tenga bonita letra 
3677,0,y tal vez las decisión que tomé es algo tonta pero es necesario 
3678,0,la vida adolecía menos y eso que estaba bien tonta 
3679,0, a la madre actualizaron más de lo que pensaba jaba 
3680,0, a huevo chingada madre¡ 
3681,0,jamás ha habido un niño tan adorable que la madre no quieraponer a dormir 
3682,1,paraguay y peru no pueden hacer un pinche gol para dejar fuera a los putos cocainos chingada madre 
3683,0, nos vale madre sudaca 
3684,1, alv tu apoyando a méxico mañana va a llover a raja madre 
3685,0,todo por andar estudiando cosas feas pero ya solo un semesteeer y habemuss engineer 
3686,0,ah qué putas ganas de arrancarte los labios a mordidas 
3687,1,me caga que los putos artistas extranjeros vengan a nuestro a país a decirnos que es lo que está mal y debemos cambiad 
3688,1,¡ya cállate alv maldito chairo cierra el puto hocico pinche gorda femichaira 
3689,0,una camisa que diga “pos si soy joto me vale verga” 
3690,1,hahahahahaha ya parece que la novia de luis se va aprestar alos juegos de esa golfa sabiendo y viendo las mentiras que a dicho 
3691,0,cofundador de twitter culpa a las redes sociales de volver más tonta a la gente <> 
3692,1,hijos de sus putas madres no sé cuál es más pinche feo 
3693,0,me dormí a las doce y ya desperté vale madre 
3694,1,deshuevaditos aquí no aquí es donde les quiero partir su madre a estos putos 
3695,1,no pinche honduras por putos tramposos se la van a pelar vamos méxico échale una manita a usa 
3696,0,te la mamaste david el problema de todos los equipos de la es el no te fijes en pequeñeces 
3697,0,va pero sin mirarnos a los ojos porque eso ya es muy joto 
3698,0, andubieron regalando pasteles o eran de chocolate algo así ya mejor me voy o dire cosas muy feas 
3699,1,mis putos vecinos tienen fiesta y deciden subirle a la música justo cuando empieza a darme sueño váyanse a la vergui plis 
3700,0,literal sere la gata bajo la lluvia 
3701,0,estoy en esa etapa de la vida llamada desde que me vale verga todo soy más feliz 
3702,0,al rato tengo que exponer de problemática y no sé ni qué onda pero yo siempre expongo poca madre así que equis 
3703,0, yo le contesté a él y a sus defensores y ahora me dicen cosas feas 
3704,1,no chinguen de donde sacaron al árbitro del gallos va cruz azul que se dedique a vender tacos hdp 
3705,1,una ya no puede enamorarse a gusto porque llegan las putas arrastradas y tu novio cae como todo un pendejo 
3706,0,cuando el instructor te pide verga pues se la das rt 
3707,0,que loco es un querer que te entiendan y no explicar nada de lo que te pasa unapoetizaloca 
3708,1,ya me llegaron todos puto silvestre y salvaje controla a tu nalga está de hormonal la loca 
3709,1,lee bien con atencion la oracion son putas que andan con varios hombres no que esten rodeadas de ellos 
3710,0,mi primo esta bien jodido y se puente cagado por los dolares 
3711,0,me tiene harta el anuncio de tumblr en todos los putos videos de youtube 
3712,0,todos los días son un buen día para preguntarte si estás haciendo lo que te gusta o andas valiendo verga 
3713,0,no quieren que uno e amargue pero hay putas peregrinaciones desde octubre 
3714,1, eres un puto y se mete con mujeres jaja maricon 
3715,1, wey oigo a los jotos decir que es normal ser puto no mames frida no es normal bro 
3716,0,hoy se dio una vuelta a la clase con una idea un poco loca para trabajo agustin los hace enloquecer 
3717,0, gladys bojórquez y leslie padilla madre e hija y años 
3718,1, que chinge asu puta madre el tico ese tan mediocre es su pais que ve programas de mexico chinga tu madre tico pemdwjo 
3719,0,me divertí mucho este fin pero mañana me va a cargar la fregada con mis exámenes 
3720,0,me dicen como acaba el partido por favor tengo que lavar trastes antes de que mi mamá me parta la madre 
