,Category,text
5463,0,goey no dormir ni poquito por el dolor de brakets neta hasta de pinches malas te pone que verga mundo neta que verga 
5464,1,ojalá e impere la imparcialidad pero lo dudo seguro le salvan el culo a los argentinos putos 
5465,0,en minutos cumplo putas horas de mi casa al trabajo alguien que me mate 
5466,0,por que me tuve que enfermar antes de puto mun vale verga 
5467,0,ernesto d'alessio sale en defensa de su madre 
5468,0,pero está loca xd aunque sí es amor por eso setsuna la cuida musho uwu 
5469,1,jajaja así les voy a decir que te digan la próxima vez que andes de marica pidiendo comida de dieta 
5470,0,como que a esta foto le hace falta o que me pasen la lengua o una buena verga alou 
5471,0,hola perritos feliz dia apenas jueves y mi culito ya quiere verga gorda quien me lo despacha con leche quiero mucha po… 
5472,0, no mms no lo superó aún digo que el don de rayas es un puto marca 
5473,0,con un puto carajo no presto películas yo libros para que se los pinches queden cagones fuck damn it 
5474,1,esta diputada está loca debería prohibir aumentos de sus sueldos y promover más el deporte no prohibirlo 
5475,0,apenas fue mi cumpleaños y pues apenas abrí los regalos fueron pocos pero no mamen se pasaron de verga 
5476,0,que cabrones yo están desahogándome con mis amigas de que ya no iban a subir video llorando como loc… 
5477,0, ya le andan haciendo competencia en 
5478,0,que pinche golazo se acaba de mamar mi hermoso 
5479,0,no veo ni madres como fui a romper mis lentes en distrito federal mexico 
5480,0,yo no soy gracioso y estoy de la verga prueba de que dios aprieta y ahorca 
5481,0,porque putas te extraño tanto porque que mierda 
5482,0, es una alegoría de cosas más oscuras y feas que un payaso diabólico el abuso infantil 
5483,0,estoy en un mood de todos valgo verga y también yo 
5484,0,cuando vi este comercial de ziploc me acordé de la hermosa y luchona 
5485,0, estuvo cagado porque estábamos en casasano y de la nada ya estábamos en villa wtf y había mil caminos cerrados 
5486,0,costumbre tonta de seguir contigo 
5487,0,en mi próximo libro explicaré como usar el mal genio para alejar al chico con el que ya no quieres salir sin parecer una maldita loca 
5488,1,ya nomas sienten que lo tienen asegurado a uno y se empiezan a tardar en whatsapp las hijas de sus putas madres 
5489,0, no sé cómo me siento de que belinda esté usandote para filtrar está información solo porque está bien ardida con ese wey 
5490,0,todo iba bien en el cartel del vive latino hasta que llegas a la t y no ves a pretenden que vea al cartel no mamar 
5491,0,a uno le pueden gustar físicamente personas y no pasa nada pero nada más te empieza a gustar alguien x su personalidad… 
5492,0,órale ahora se tiene uno que cuidar hasta de las mujeres estamos jodidos 
5493,0, qué lío me tenéis con lo del juernes de bragas que si lunes de ojetes o que si las barbas de no sé qué de su puta madre 
5494,1,neta ya estoy ruquiando todo los joterias que hacen los morros de hoy en día me molestan pinches putos 
5495,0,¡gooooool ¡que puto golazo como la traigas 
5496,1,rompen la pija con ese maldonado de mierda y ni hablan de delfina que con años y meses la encontraron muerta mangas de cínicos hdp 
5497,0,lo más chido de berlin es que uno puede ser como quiera y a todos les vale verga católico drag puta joto monja etc aprendamos amigos 
5498,0,si la que falló el tecatito hubiera sido chicharitomadre de dios con martinolli soguiera rompiendole las pelotas 
5499,0,jajaja por qué es tan ardida tu amiga 
5500,0,la bachata tiene letras muy tontas pero cómo me pone de buenas 
5501,1,tu queria una nena y tu papa queria un varon tu para complacerlos te volviste maricon 
5502,1, vete a la verga puto pompeyo es mejor que tu y nova es mucho mejor que sandstorm 
5503,1,y yo que siempre pensé que yáñez era medio maricon 
5504,0,para que quiero spotify si mi vecino todo el día tiene música a alto volumen dijo nadie pinches putas nunca de la v word 
5505,0, gooool putos el chucky el chucky gooool 
5506,1,yo no entiendo por ejemplo esos hijos que son de river y los padres de boca o al revésque tan hdp podes ser máximo traidor 
5507,1,ya supe que tienes varias enemistades pues como no culero te siente amo y señoar de espn eres un poble pendejo maricón 
5508,1, bajate pero a mamar mi verga no pares que te quiero hacer romper tu culo a vergazos 
5509,1, putos mierdas un aborto debe de acompañarse con asistencia psicológica y apoyo así como al padre hacerlo cumplir por su responsabilidad 
5510,0, cota rescinde tu contrato we recuerda que fue chivas quien apostó por ti y no los tuzos acá eres el puto amo 
5511,0,debo borrar mi historial en google y todas las preguntas que he hecho sobre las putas antes de que llegué mi novia 
5512,0,confieso que sigo bien ardida con la comunidad científica por descubrir que plutón no es planeta <> 
5513,0,detrás de cada niño pequeño que cree en sí mismo se encuentra una madre o una padre que creyeron primero 
5514,1, hijo de tu puta madre deja a almeyda trabajar agusto 
5515,0, siii pero ella por tonta pero a mi me gusta fernandino y el seguirá le pondran a otra chava 
5516,0,pa que te mando memes si me vas a dejar en pinche puto visto 
5517,0,esta de la fregada este lunes no importa cuando lo leas para mi todos los días son lunes porque me levanto jodido 
5518,1,chingue a su madre pinche profesor de 
5519,0,ay ya seee estoy re loca todos me lo dicen todo el tiempo 
5520,1, que casualidad que raul cervantes tenga un ferrary o sera que es un hijo de toda su puta madre priista corrupto igual enrrique peña nieto 
5521,1, te dieron en tu madre dr tamez jajaja 
5522,0,me cago en las putas materias en linea yo no funciono así o sea no 
5523,0,el arte arcaico de mi mamá luchona favorita 
5524,0,el futbol mexicano no existe argentino hijo de putas saludos desde morelia mexico 
5525,0,que de la verga que te enamores de alguien que que evidentemente no te quiere tal cual eres 
5526,1,chinguen a su madre todos menos ella es chida 
5527,0,lo que viene siendo las ganas de mamar ya mejor hubieran dicho que el negro se robó el teléfono 
5528,0,no creo que seas gorda todas las mujeres dicen estarlo 
5529,0,ya van a mamar la serie con estas frases todas mamonas sin sentido 
5530,1,podrán decir que soy una ardida pero no lo digo con fundamentos los hombres son una puta basura de mierda perros hijos de la chingada 
5531,0,básicamente la felicidad consiste en que te valga madre la vida de todos los demás y vivas la tuya como quieras 
5532,0,esa niña esta loca ni le hacen falta xd y quiero ir a verte bro necesito tanto un break pero las ventas están mejorando 
5533,0,mamá cómprame las botas mas feas que encuentres porfa <> 
5534,0,qué verga con los que salen del gym y prenden un cigarro no es sólo salud qué no les arde el pecho y les duele la vida 
5535,0,rt chicochevive se acuerdan cuando juansolo venía cada quincena a tabasco pues el ya no porque les vale verga los tabasqueños 
5536,0,real vienes con crop top a la escuela si no te corren por joto te corren por atreverte a usar uno con este frío 
5537,1,no sea joto si crítica aguante mucha boca pa criticar poca cara para aguantar nada de ruin aguante 
5538,0,que pedo con todos los hemos que decían que era su estilo de vida y no lo dejarían y la madre y ahora son súper última tendencia 
5539,1,me acabo de chingar taquitos al pastor por pesitos vas y chingas a tu madre cuais 
5540,0,estuviéramos cojiendo pero estás dormido disque porque estás cansado y así no se putas puede 
5541,1,maricas vendidos de my patria y amigos coaxpa no c olvida cabeza de juarez tlampan tampoco mileniagays o putos 
5542,1,vales pa pura verga punto maricon pinche actorcillo de tiangis chingas a tu madre 
5543,0,amo esta sonrisa m tiene loca 
5544,1,gorda pelotuda 
5545,0,ya te diste cuenta que el año el sexenio y tu vida están valiendo madre de nada 
5546,1,si me va y me lo han dicho las nenorras que si saben pero tu que vas a saber y si te ves más gorda que antes 
5547,1,lo tienen bien merecidos putos se hizo justicia 
5548,0,no puedo dormir sé que les vale verga pero aun así se lo quiero compartir no seas culeros 
5549,0, valio madre ya me atacó el insomnio 
5550,0, pero aquí te tengo comiendo camote topaste con pared y vas a ver que te voy a empinar primero <> 
5551,0,ya me va a valer madre alabestia 
5552,0,ay putas igualito siempre estoy ahí para todos nadie está ahí para mí la historia de mi vida 
5553,0,wau que buena estas un culo rikisimo para chupartelo todito y meterte toda mi verga dejarte llena de leche 
5554,1,me cago en la puta madre de trump que manera de andar tocando los huevos anda que se vaya un poquito a la mierda el muy hijo de puta <> 
5555,1,oooo y no es empleado de trump y además lameculos del gringo 
5556,0,dale rt quieres hacerlo con una embarazada una hora por estoy lactando 
5557,0,hablan de la palabra vagina o de la palabra verga no sé estoy confundida por saber vocabulario ayud… 
5558,0,eh putos en el nuevo site de mi chamba que es un wordpress jajaja cada sucursal está en un post jajajajaja 
5559,0,o sea seasons que llevo jugando lol y tengo los putos skins victoriosos y ninguno de ellos me gusta gg 
5560,0,si vieron a una niña correr en tacones por todo el centro buscando cambio y después como loca con un acta de nacimiento en la manosíera yo 
5561,0, ya me voy a regresar a vivir a tus rumbos para hacer pijamada y yo te voy a chiflar con algo que me queda bien rico 
5562,1, jajajajajaja ese joto que va a saber de narcotrafico lo que es abrir la boca a lo idiota 
5563,0,después de todo este tiempo estoy loca por ti no supere las mariposas y cariño en las peores noches estoy loca por ti 
5564,0,pareciera el día de recordarme que voy rumbo a ser una loca de los gatos solo tengo dos no es para tanto o si 
5565,1,eres y serás un hdp ese fue es y será tu talento 
5566,1,callate maldito llorón claro como ya no pudiste apoyar a ecuador vas de marica con otros partidos 
5567,0, que tonta es la gente que se va con las calificaciones de box de lamita y creen que ese sera el resultado oficial tarugos 
5568,0,pues será muy feminista pero me saca ronchas ortográficas cada que lo leo y ronchas de las feas 
5569,0,y el delincuente de romero deschamps en primera fila para de mamar 
5570,0,yo amo el cliché gay what's wrong with be like that sé el joto que quieras ser y punto 
5571,0,cuando tienes dos hermanos hombres es imposible no ser una gorda 
5572,0,ya vieron quién va a dirigir a mi bayern agarrense putos 
5573,1,anticonstitucional pagar multas con d descuento d pesos cuando el salario mínimo diario ni d chiste es eso hdp 
5574,0, presentamos al músico de mierda de siempre que toca todas las putas semanas en este bar hediondo porque le regalan pisto y chicharrines 
5575,0,nuevo aporte mi rica tia vaya que sabe cabalgar bien rico sobre la verga 
5576,0,la buena soy el crush de mi crush la mala somos bien putos los dos 
5577,1,gorda religiosa y mal vestida aparte mega puta 
5578,0, estoy hasta la puta madre jajajajajaja 
5579,0,que como decía mi madre bailando todo se arregla siempre hay que encontrarle lo bueno a la vida 
5580,1,si me van a engañar no se busquen viejas tan feas y pendejas por fa 
5581,0, cabrón soy tu pinche fan men si antes tenia pasión por la cocina con tus videos ahora mucho más 
5582,1, de parte mia chinga tu madre saludos 
5583,0,me he vuelto un experto contando calorías me estaré volviendo viejo o joto o un insoportable ex gordo sabe 
5584,1, que pendejo así l hablas a tu puta madre 
5585,0,los muros no solucionan el problema hay que tener políticas de desarrollo entre países de origen tránsito y de destino 
5586,1, insistes en seguir diciendo pendejadas senil ignorante parasito pronte trabajar y dejar de mamar dinero de nuestros impuestos rata 
5587,0,chingada madre que soy pasivo 
5588,0,si quieres hasta me puedes dejar tu numero de contacto para que te avise cuando me dejes de valer tanta verga 
5589,0,nos dejamos ir como gorda en tobogán 
5590,0,los miércoles me la vivo mas cagado de lo normal odio los putos miércoles 
5591,0,estoy demasiado gorda no volveré a comer nunca 
5592,0,y todo mundo mamando con la película de disney pixar coco si hubiera sido hecha por mexicanos tendría el mismo boom 
5593,0,uy te vuelves loca en agüitas ahora que viene el festival de las calaveras hay tanta cosa de esas 
5594,1,yo si te veo en la calle te pego una verguiza ponte con alguien de tu edad en el elevador puto tamalon maricon 
5595,0,la afición americanista se vuelve loca américa chivas 
5596,0,es bien cagado como los únicos tuits de gloso son de metiche en otros tuits 
5597,0,de qué me sirve dar putos unfollows si me siguen saliendo cada que le dan like a sus tuits inmamables 
5598,1, y salen los putos a tener fantasias con los o chef irlandés 
5599,1,ya estas ahí hijo de perra sea hombrecito y esperelos para que se den en sus putas madres pinche maricon de mierda 
5600,0,ya no entendí nada quede loca con la revelación del final 
5601,0,la maldita obesidad esta cabrona jajajaja <> 
5602,1,según la perra loca los pedos del país son por la corrupción 
5603,0,no mamar tanta mercancía a la cercanía y no la había notado 
5604,1,me caen mejor los gringos que los putos centroamerichangos llámense como se llamen 
5605,0,cómo me encanta la verdad q me den así no me lleno de verga además quiero panocha para chupar también alguna pareja <> 
5606,1,y el aprendiz dice que no hablemos mal del marica de peña nieto y todos estos ojetes matando y robando no tienen madre 
5607,0, el de rojo jajaja nada mentira ya me estoy quedando loca mientras votan reproduzcan 
5608,0,es cierto que las cosas hay que pedirlas de buena forma pero no de una manera marica y cae mal 
5609,1, gran parte se destinira para las putas ratas del pais ojala hicieran una fiscalia q cuidara las donaciones y se hicieran publico lo gastado 
5610,0,putos pesados con sus alternativas y su diálogo sí ha dicho el rey que guerra pues guerra 
5611,0,por qué me pusiste el examen más cabrón al último señor ¡por quééé vale verga 
5612,1,patético nefasto corriente asqueroso lo de los putos hondureños de mierda ojalá queden fuera jueguen fútbol hijos de puta 
5613,0,mala suerte o deplano hay gente bien tonta para manejar ‍ 
5614,0,o aún no empieza esa idiotez 
5615,0, es que facebook es el paraíso de las feas jajajaja 
5616,0,siempre hay putas en negación que a pesar de que siempre se les observa con distintos hombres argumentan no ser putas solo muy “sociables” 
5617,0,la cuarentona mamando mientras el esposo trabajando 
5618,1,ojalá arrase con tu puta madre te parió muy pendejo cerebro de mierda 
5619,0, el feminismo no significa ser extremista me considero feminista y no estoy tonta creo jeje ni culpo a todos los hombres pero está cabrón 
5620,0,me veo más gorda en vivo 
5621,0,no pues que batallón se dieronambos están bien armadosni a cual irlepero como dice cricri… 
5622,0,la gente ridícula bloquea como si bloqueando eliminando sus heridas o los ardidas se les quitara <> 
5623,0,la columna de y luego de conocermeel nobel escribió “mis putas tristes vía 
5624,0,ahora si ya deje de estar de chilloncito marica ma' frens 
5625,0,méxico país lleno de gente luchona que lo da todo por mujeres que pelean contra el y no se rinden por eso y mas 
5626,0, se me fue el pedo jajajajajaja chale bale berga 
5627,1, jajaja puro puñeta amargado ya superenlo regios chupense sus tecates y partanse su madre rayados y tigres es lo unico que saben hacer 
5628,0,esta de la acostumbrarte a acortar todo y que ahora ya hasta te sobre el espacio 
5629,0, está cabron 
5630,1,este niño te tiro mrd y el maricón no quiere aceptar que la cago 
5631,0, jajajaja paren de mamar hay que saber leer cuando algo es “sarcasmo” y cuando no lo digo por qué quiero que el azul la cague otra vez 
5632,0,traigo ganas como de que te sientes en mi verga dura y venuda 
5633,0,tengo unos putos nervios de no haber pasado el examen de termo 
5634,1,es de putos maricones tener la app de skyalert en tu celular 
5635,0,haver si es sierto que las tienes todas pon dna de bts si no eres puro choro y lanovia loca del pege 
5636,1,aquí en cuaad los morros que se sienten más verga para dibujar son los que más culero diseñan 
5637,1, no somos pendejos pinchi pelon cagado 
5638,0,qué sabrá de amor cupido si no a cogido con putas 
5639,0,jajajaja aquí es en donde yo ahora digo “putos celos que te cargas” 
5640,0,me estoy muriendo del dolor y les vale verga 
5641,0,tengo antojo de unas takis fuego ser o no ser gorda 
5642,0,o siendo las ya estaba gritando como loca por tener a katy en frente 
5643,0,morras que le hablan de wey a su vato y dicen la palabra verga a la menor provocación también deberían hacer servicio militar 
5644,0, jajajaja súper cagado 
5645,0,pa que vean que en chiapas no hay pura prieta <> 
5646,0,bueno dado que a cualquier hora está cabrona la inseguridad en villahermosa esperemos la combi 
5647,0,cuando quedan días para hacer el pia y no han hecho ni madres 
5648,0,ya estaba pendeja antes de conocerte ni te emociones 
5649,1,y el muy hdp pretende dar lecciones al presidente de mi patria venezuela 
5650,0,con mis acciones demuestro que aun soy muy inmaduro pero pues me vale verga 
5651,1,mi prima la gorda hablando de la arquitectura del restaurante 
5652,1, vas mucho a chingar tu madre junto con josé ramón fernández comentaristas de cuarta el estadio de san luis es de primera 
5653,0, tu lap deja de funcionar el cable nuevo de tu cargador no carga y te chingas más la rodilla 
5654,1,este debe ser un maricon encubierto porque los que apoyan esto que es algo aberrante son maricones 
5655,0,hay gente que llega tarde a clases y va corriendo y luego estoy yo valiendo verga y además siento lenta 
5656,1, jajajajajaja estas bien tonta la cagaste 
5657,0, habemos unas feas y no estás viejo 
5658,0,esta está loca solo fue mal entendido desde un principio porque no dijo nada la señora 
5659,0,quiero mamar vergaaaa tragar semen tengo antojo cabrón 
5660,0, que tengan tantita madre así como cuando lo piden 
5661,1,arriba méxico hijos de su puta perra madre y que chinge su puta madre el terco 
5662,0,no mames bro pensé que eras más grande que yo d verga 
5663,0,hasta extraño votar en hts por sos y ponerme como loca hasta la noche para que ganen los hijos de puta 
5664,0,y en otras noticias amo la comida frita mejor si es empanizada porque gorda en cuerpo de flaca 
5665,0,me tragué ¡ putos whiskys anoche ¡dos y traigo una resaca como de domingo de gloria 
5666,0,doña elenita no es escritora de mi devoción pero no mamar qué sensibles creo que ni las juchitecas se ofenden 
5667,0, en vez de darle en su madre a un paparazzi se lo diste a una fan chale 
5668,1,todos los que tienen nombre que empiezan con u son putos 
5669,0,mi novio sube mi fotos más feas pero así lqm 
5670,0,quiero pensar que estoy menos gorda que hace un mes 
5671,0,complaciendo a mi amor con sus fantasías 
5672,0,pienso lo mismo q no te afecte ni te creas si alguien te dise gorda nena eres gupisima 
5673,1, que bueno que alguien más sabe la verdad al menos no van a estar tranquilas esas mujeres feas 
5674,0,quien dice que las camionetas automáticas son para putos estan equivocados son para machos que gustan de sabrosear las piernas de su amada 
5675,1,me duele la cabeza me duele el corazón chingas a tu madre si tocas otra canción 
5676,0,a mí me llega un pendejo a darme latas de atún sardina y botes de agua y lo mando a la chingada o sea me quede sin casa no estoy a dieta 
5677,1,ahora q los agarro juntos chaspm ambos pinche par de putos 
5678,0,un día me puedes gustar y puedo terminar volviéndome loca por ti pero si la cagas ¡agarrate 
5679,0,me enoja mucho que celebran cosas bien tontas 
5680,0,que puts triste es levantarte súper temprano para ir a la escuela solo putas horas 
5681,1,jajajajjajajanjaa pinche joto le dio miedo saber que el miercoles iba vs el mas grande 
5682,0,no mames yeye yo si amé tu álbum pero perdóname por no ser una fan loca como las nuevas niñitas 
5683,0, jura no conocer a victoria autoridades le creen después jura que victoria era drogadicta y que estaba loca le creen 
5684,1, todas tienen en común son viejas feasambiciosaspanistas y quieren vivir del erario publico 
5685,0,del al le vales verga qué tan ocupado creen que esté como para que no me haya contestado desde hace una semana 
5686,1,ya no saben qué verga decir consigan una vida y sufran o algo 
5687,0,que no quieren vernos la cara si les caigo malno sean putas hipócritas a la vergani me digan hay te <> 
5688,0,ya lo veo venir el miércoles el profesor me tirará de a loca y derechista perdón por no confiar en ninguno político profesor 
5689,0, de seguro le falto el camote pare el postre \ 
5690,1, éstos gandallas s sirven con la cuchara grande tráficantes d influencias hdp 
5691,0,ah cabron soñé que la ex de mi vato quería pelear conmigo porque le robe un cerillo según ella le dije que no y la terapie y me beso d 
5692,0,tengo una hora despierta y putas malas noticias no hay laboratorio de físico química 
5693,0,todos durmiendo y yo partiéndome la madre con la tarea ya odio la escuela 
5694,0,como cuando llevabas hot dogs a la primaria y cada que le dabas una mordida tus amigos se agarraban la verga y hacían como que les dolía 
5695,0,estar en el servicio con puro vato friki está bien cagado jajajaja 
5696,0,tengo años tatuajes piercings hijos mascotas porque verga sigo vivo 
5697,0,cuando creo que me va de la verga y todo está mal resulta que todo va bien 
5698,0,qué verga voy a andar necesitando a alguien que me pregunte por mi día me dé las buenas noches o esas mamadas eso es de baja autoestima 
5699,0,lo que odio de los días festivos es que trago como cerda y todo el día me siento gorda 
5700,1, huecos hdp den la cara mal nacidos con servidores públicos como estos para que putas lleguen a renunciar y no regresen bastardos 
5701,1, chupame la pija aaaa jajajajajaja queres ver si soy traba hdp 
5702,1, ahora ofrezcan una disculpa por las mentiras que dicen y la manipulación tendenciosa de la información ya sé no tienen madre hdspm 
5703,0,no llores porque terminó sonríe porque no te los echó adentro convirtiéndote en luchona 
5704,0,ojalá asi me agarrars cuando te digo que me voy en lugar de correrme a la verga cada minutos 
5705,0,hoy amanecí con ganas de mamar verga todo el día 
5706,1, puede que sea muy buey lo seguro es que es uno de los lameculos preferidos del sistema… 
5707,1, a nosotros tu pinche puta vida hdp pendejo 
5708,0,acaso es pecado no estar nalgona y chichona explíquenme 
5709,0,leia la primer mujer luchona espacial 
5710,0,cuando waze te manda por puras calles chiquitas y feas <> 
5711,0,el año pasado yo digo porque no te callas to me madre yo estaba muy tonta gtlt 
5712,0,ya no voy a tener amigas todo es muy complicado jajajaja estando sola no hay razones para armarla de pedo ‍ 
5713,1,virtudes de los políticosidiotasraterossin sesosrateroscinicos y no festejan el mayo por no tener madre chulada de espécimen <> 
5714,0,como me emputo perder el tiempo con gente que no sabe ni qué putas quiere 
5715,0,y la risa d estos psicopatología los perversos son cínicos no hay verguenza culpa o asco no hay ideología en suma reniegan d su madre 
5716,1,putita te agarraria de tus caderas y tecojeria muy fuerte despues lameria tus nalgas asta aserte venirte 
5717,1,de verdad que estas feo pinche mazatleco indígena y maricon jodido de mierda 
5718,0, deje de andar mamando palo porque jamás la voy a conocer cuando ella llegue ya no voy a estar 
5719,0,quiero tener contigo una noche loca con derecho a desayuno 
5720,1,putos los que van en carro y mojan más a las personas 
5721,0,aunque no este ardida que pinche canción tan chingona de don sam smith fue bueno esperar años <> 
5722,0,valiendo madre yo mañana no voy por una sola clase y menos que es la de las de la mañana 
5723,0,puta madre odio que tengan los dientes bonitos 
5724,0, haaaaaaa especifica yo pensé ya me ganaron alguien ya la hizo mamá luchona 
5725,0,de verdad que un día de estos me voy a volver loca de tanta tarea 
5726,0,de los errores se aprende bien cabrón 
5727,1, ridículo creyendo que ganó el canelo confirmas ser poco conocedor de box otro pinche villamelon pendejo hdp alv pinche fanboy 
5728,0,pd que fue lo que paso no te cargo la app o te pidio clave para entrar 
5729,0,se me retrasa el periodo pero los putos granos me siguen saliendo 
5730,0,ando bien intensa juju 
5731,1,son unos putos abusivos de mierda iusacell nunca había hecho estas porquerías 
5732,1,creo seriamente que se ven bien pendejos justin y selena gomez no mamar neta 
5733,0,me quedó bien bonito mi cabelluki pero me da un chingo de hueva ir al salón putas horas porque pinche greñero 
5734,1,váyase a la pinche verga y de paso llévese a la pinche piruja de 
5735,0, chongos zamoranos si ¡chongos zamoranos dónde putas encuentro chongos zamoranos es en 
5736,0, porque ya me tienes en tus manos cabrona 
5737,0, jajajaja le aguanto todo el amor a una madre 
5738,1,si ya sabes que me cagan mis hermanastras para que putas me presumes sus logros si sabes que me vale verga 
5739,0,no hay nada más cagado que ver cómo te barren a través del reflejo de un vidrio 
5740,0,en recupera policía a niño q había sido extraído de los brazos de su madre en 
5741,0,les gustan los mexxxicanos delgados que el este que nos comparte su verga 
5742,1, los lameculos siempre defendiendo al que les da el hueso y además creen que todos son de su condición para putas tu puta madre es la líder 
